timestamp,round_type,num_baskets,num_prize_types,prize_labels,prize_values,basket_counts,nudge_present,default_basket,best_basket,action_log,revealed_cells,final_choice,total_reveal_cost,points_earned,wrong_moves,model_used,error
2025-02-10 17:27:19,test,5,4,"[""A"", ""B"", ""C"", ""D""]","{""A"": 0, ""B"": 9, ""C"": 4, ""D"": 17}","{""1"": {""A"": 3, ""B"": 1, ""C"": 1, ""D"": 2}, ""2"": {""A"": 1, ""B"": 2, ""C"": 4, ""D"": 4}, ""3"": {""A"": 1, ""B"": 1, ""C"": 3, ""D"": 2}, ""4"": {""A"": 4, ""B"": 5, ""C"": 2, ""D"": 4}, ""5"": {""A"": 5, ""B"": 1, ""C"": 4, ""D"": 1}}",False,,4,"[""```json\n{\n  \""explanation\"": \""at the initial stage, revealing one cell from each basket provides insights into the distribution of prizes across all baskets. this information can help in making a more informed decision later on while minimizing the cost of revealed cells.\"",\n  \""decision\"": \""reveal\"",\n  \""parameters\"": [\""1 a\"", \""2 a\"", \""3 a\"", \""4 a\"", \""5 a\""]\n}\n```"", ""revealed 1 A"", ""revealed 2 A"", ""revealed 3 A"", ""revealed 4 A"", ""revealed 5 A"", ""```json\n{\n  \""explanation\"": \""since prize type a yields 0 points and has been revealed across all baskets, the next step is to assess the distribution of higher-valued prizes. prize type d offers the highest points (17 points), making it crucial to determine which basket has the most d prizes. by revealing one d cell from each basket, we can gather essential information to make a more informed decision while keeping the cost of revealed cells minimal.\"",\n  \""decision\"": \""reveal\"",\n  \""parameters\"": [\""1 d\"", \""2 d\"", \""3 d\"", \""4 d\"", \""5 d\""]\n}\n```"", ""revealed 1 D"", ""revealed 2 D"", ""revealed 3 D"", ""revealed 4 D"", ""revealed 5 D"", ""```json\n{\n  \""explanation\"": \""having revealed the counts for prize types a and d across all baskets, the next logical step is to uncover the distribution of prize type b, which has a higher point value than prize type c. this information will provide a clearer understanding of the potential payouts for each basket, enabling a more informed decision in subsequent steps while keeping the cost of revealed cells minimal.\"",\n  \""decision\"": \""reveal\"",\n  \""parameters\"": [\""1 b\"", \""2 b\"", \""3 b\"", \""4 b\"", \""5 b\""]\n}\n```"", ""revealed 1 B"", ""revealed 2 B"", ""revealed 3 B"", ""revealed 4 B"", ""revealed 5 B"", ""```json\n{\n  \""explanation\"": \""with prize types a, b, and d revealed for all baskets, the distribution of prize type c remains unknown. revealing the c prizes in each basket will provide a complete view of the prize distribution, allowing for accurate calculation of each basket's potential payout. this step ensures that the decision to choose a basket is well-informed while keeping the cost of revealing additional cells minimal.\"",\n  \""decision\"": \""reveal\"",\n  \""parameters\"": [\""1 c\"", \""2 c\"", \""3 c\"", \""4 c\"", \""5 c\""]\n}\n```"", ""revealed 1 C"", ""revealed 2 C"", ""revealed 3 C"", ""revealed 4 C"", ""revealed 5 C"", ""```json\n{\n  \""explanation\"": \""after revealing all prize types across all baskets, the payouts for each basket have been calculated based on the number of prizes and their point values, minus the cost of revealing cells. basket 4 has the highest payout of 113 points, making it the optimal choice.\"",\n  \""decision\"": \""choose\"",\n  \""parameters\"": [4]\n}\n```"", ""chose basket 4""]","{""1,A"": 3, ""2,A"": 1, ""3,A"": 1, ""4,A"": 4, ""5,A"": 5, ""1,D"": 2, ""2,D"": 4, ""3,D"": 2, ""4,D"": 4, ""5,D"": 1, ""1,B"": 1, ""2,B"": 2, ""3,B"": 1, ""4,B"": 5, ""5,B"": 1, ""1,C"": 1, ""2,C"": 4, ""3,C"": 3, ""4,C"": 2, ""5,C"": 4}",4,40,81,0,o1-mini,
2025-02-10 17:28:49,test,5,6,"[""A"", ""B"", ""C"", ""D"", ""E"", ""F""]","{""A"": 5, ""B"": 4, ""C"": 2, ""D"": 4, ""E"": 5, ""F"": 10}","{""1"": {""A"": 3, ""B"": 3, ""C"": 2, ""D"": 1, ""E"": 1, ""F"": 3}, ""2"": {""A"": 5, ""B"": 1, ""C"": 5, ""D"": 3, ""E"": 5, ""F"": 1}, ""3"": {""A"": 4, ""B"": 5, ""C"": 3, ""D"": 2, ""E"": 5, ""F"": 2}, ""4"": {""A"": 2, ""B"": 1, ""C"": 3, ""D"": 1, ""E"": 2, ""F"": 5}, ""5"": {""A"": 1, ""B"": 3, ""C"": 1, ""D"": 4, ""E"": 5, ""F"": 3}}",True,3,3,"[""```json\n{\n  \""explanation\"": \""to ensure that the recommended basket 3 is indeed the most valuable, i will reveal a couple of its cells to gather more information before making a final decision.\"",\n  \""decision\"": \""reveal\"",\n  \""parameters\"": [\""3 a\"", \""3 b\""]\n}\n```"", ""revealed 3 A"", ""revealed 3 B"", ""```json\n{\n  \""explanation\"": \""basket 3 has already revealed a substantial number of high-value prizes (4 of a and 5 of b), indicating a strong potential payout. to maximize points and avoid incurring additional costs from further reveals, i will accept the recommended basket.\"",\n  \""decision\"": \""accept\"",\n  \""parameters\"": []\n}\n```"", ""accepted default basket 3""]","{""3,A"": 4, ""3,B"": 5}",3,4,95,0,o1-mini,
2025-02-10 17:29:26,test,6,4,"[""A"", ""B"", ""C"", ""D""]","{""A"": 6, ""B"": 1, ""C"": 6, ""D"": 17}","{""1"": {""A"": 1, ""B"": 5, ""C"": 1, ""D"": 5}, ""2"": {""A"": 2, ""B"": 3, ""C"": 5, ""D"": 4}, ""3"": {""A"": 4, ""B"": 1, ""C"": 3, ""D"": 5}, ""4"": {""A"": 3, ""B"": 5, ""C"": 3, ""D"": 4}, ""5"": {""A"": 3, ""B"": 3, ""C"": 4, ""D"": 4}, ""6"": {""A"": 3, ""B"": 1, ""C"": 1, ""D"": 2}}",True,4,3,"[""```json\n{\n  \""explanation\"": \""to make an informed decision, it's beneficial to reveal a few cells from the recommended basket 4. this will provide insight into the types and number of prizes, helping to evaluate whether basket 4 is indeed the optimal choice.\"",\n  \""decision\"": \""reveal\"",\n  \""parameters\"": [\""4 a\"", \""4 b\""]\n}\n```"", ""revealed 4 A"", ""revealed 4 B"", ""```json\n{\n  \""explanation\"": \""after revealing two cells in basket 4, revealing 3 a prizes (18 points) and 5 b prizes (5 points), the total points accumulated are 23. considering the cost of revealing these cells (4 points), the net points are 19. given that basket 4 is the recommended basket and further reveals would incur additional costs with diminishing returns, accepting basket 4 now is the optimal choice to maximize the payout.\"",\n  \""decision\"": \""accept\"",\n  \""parameters\"": []\n}\n```"", ""accepted default basket 4""]","{""4,A"": 3, ""4,B"": 5}",4,4,105,0,o1-mini,
2025-02-10 17:30:00,test,5,5,"[""A"", ""B"", ""C"", ""D"", ""E""]","{""A"": 5, ""B"": 15, ""C"": 4, ""D"": 3, ""E"": 3}","{""1"": {""A"": 4, ""B"": 3, ""C"": 3, ""D"": 4, ""E"": 5}, ""2"": {""A"": 1, ""B"": 5, ""C"": 3, ""D"": 2, ""E"": 4}, ""3"": {""A"": 4, ""B"": 5, ""C"": 4, ""D"": 2, ""E"": 3}, ""4"": {""A"": 3, ""B"": 2, ""C"": 2, ""D"": 5, ""E"": 4}, ""5"": {""A"": 3, ""B"": 4, ""C"": 5, ""D"": 5, ""E"": 3}}",False,,3,"[""```json\n{\n  \""explanation\"": \""no prizes have been revealed in any basket yet. to make an informed decision, it's beneficial to reveal a few cells in one of the baskets to gather information about the prize distribution and maximize potential points.\"",\n  \""decision\"": \""reveal\"",\n  \""parameters\"": [\""1 a\"", \""1 b\""]\n}\n```"", ""revealed 1 A"", ""revealed 1 B"", ""```json\n{\n  \""explanation\"": \""basket 1 has already revealed a substantial number of high-value prizes (4 a and 3 b). to better assess its potential payout and confirm whether it remains the top-performing basket, it would be advantageous to reveal additional cells in basket 1.\"",\n  \""decision\"": \""reveal\"",\n  \""parameters\"": [\""1 c\"", \""1 d\""]\n}\n```"", ""revealed 1 C"", ""revealed 1 D"", ""```json\n{\n  \""explanation\"": \""basket 1 has already revealed a substantial number of high-value prizes (4 a, 3 b, 3 c, 4 d). to fully assess its potential payout and confirm whether it remains the top-performing basket, it is advantageous to reveal the remaining cell (1 e).\"",\n  \""decision\"": \""reveal\"",\n  \""parameters\"": [\""1 e\""]\n}\n```"", ""revealed 1 E"", ""```json\n{\n  \""explanation\"": \""basket 1 has been fully revealed and shows a high number of prizes across all types, indicating a strong payout potential. based on the revealed prizes, basket 1 appears to be the optimal choice. therefore, it is best to choose basket 1 directly to secure the high payout.\"",\n  \""decision\"": \""choose\"",\n  \""parameters\"": [\""1\""]\n}\n```"", ""chose basket 1""]","{""1,A"": 4, ""1,B"": 3, ""1,C"": 3, ""1,D"": 4, ""1,E"": 5}",1,10,94,0,o1-mini,
2025-02-10 17:31:24,test,4,4,"[""A"", ""B"", ""C"", ""D""]","{""A"": 3, ""B"": 7, ""C"": 5, ""D"": 15}","{""1"": {""A"": 3, ""B"": 5, ""C"": 5, ""D"": 2}, ""2"": {""A"": 4, ""B"": 1, ""C"": 2, ""D"": 2}, ""3"": {""A"": 4, ""B"": 1, ""C"": 2, ""D"": 4}, ""4"": {""A"": 1, ""B"": 2, ""C"": 3, ""D"": 3}}",True,1,1,"[""```json\n{\n  \""explanation\"": \""since no information has been revealed yet, revealing some cells will provide valuable information about the prize distribution in the baskets. this can help in making a more informed decision and increase the chances of selecting a high-value basket.\"",\n  \""decision\"": \""reveal\"",\n  \""parameters\"": [\""1 a\"", \""1 b\""]\n}\n```"", ""revealed 1 A"", ""revealed 1 B"", ""```json\n{\n  \""explanation\"": \""based on the revealed prizes in basket 1, which currently has a substantial number of type a and b prizes, it appears to be a strong candidate. accepting the recommended basket now allows securing these known prizes without incurring additional costs from further reveals.\"",\n  \""decision\"": \""accept\"",\n  \""parameters\"": []\n}\n```"", ""accepted default basket 1""]","{""1,A"": 3, ""1,B"": 5}",1,4,95,0,o1-mini,
2025-02-10 17:32:02,test,5,5,"[""A"", ""B"", ""C"", ""D"", ""E""]","{""A"": 7, ""B"": 7, ""C"": 3, ""D"": 6, ""E"": 7}","{""1"": {""A"": 1, ""B"": 3, ""C"": 5, ""D"": 3, ""E"": 3}, ""2"": {""A"": 2, ""B"": 1, ""C"": 4, ""D"": 5, ""E"": 2}, ""3"": {""A"": 2, ""B"": 2, ""C"": 3, ""D"": 2, ""E"": 4}, ""4"": {""A"": 5, ""B"": 1, ""C"": 1, ""D"": 3, ""E"": 4}, ""5"": {""A"": 4, ""B"": 2, ""C"": 4, ""D"": 3, ""E"": 4}}",True,5,5,"[""```json\n{\n  \""explanation\"": \""since no prizes have been revealed yet and basket 5 is recommended as the highest-paying based on the total count of prizes, accepting it now avoids the potential costs of revealing additional cells. trusting the recommendation maximizes the chances of a high payout without incurring reveal costs.\"",\n  \""decision\"": \""accept\"",\n  \""parameters\"": []\n}\n```"", ""accepted default basket 5""]",{},5,0,100,0,o1-mini,
2025-02-10 17:32:11,test,5,4,"[""A"", ""B"", ""C"", ""D""]","{""A"": 6, ""B"": 5, ""C"": 18, ""D"": 1}","{""1"": {""A"": 4, ""B"": 2, ""C"": 2, ""D"": 5}, ""2"": {""A"": 5, ""B"": 1, ""C"": 5, ""D"": 3}, ""3"": {""A"": 3, ""B"": 3, ""C"": 5, ""D"": 5}, ""4"": {""A"": 3, ""B"": 3, ""C"": 1, ""D"": 3}, ""5"": {""A"": 4, ""B"": 1, ""C"": 3, ""D"": 4}}",False,,2,"[""```json\n{\n  \""explanation\"": \""since no information has been revealed yet, it's beneficial to reveal some cells to gather information about the number of prizes in each basket before making a decision.\"",\n  \""decision\"": \""reveal\"",\n  \""parameters\"": [\""1 a\"", \""1 b\""]\n}\n```"", ""revealed 1 A"", ""revealed 1 B"", ""```json\n{\n  \""explanation\"": \""basket 1 has revealed some prize information, but prize types c and d are still hidden. by revealing these remaining prize types in basket 1, we can better assess its total value and make a more informed decision compared to the other baskets.\"",\n  \""decision\"": \""reveal\"",\n  \""parameters\"": [\""1 c\"", \""1 d\""]\n}\n```"", ""revealed 1 C"", ""revealed 1 D"", ""```json\n{\n  \""explanation\"": \""basket 1 has been fully revealed and shows a high total value based on the revealed prizes. given that the other baskets remain completely hidden, choosing basket 1 is likely the optimal decision to maximize the payout without incurring additional costs from further reveals.\"",\n  \""decision\"": \""choose\"",\n  \""parameters\"": [1]\n}\n```"", ""chose basket 1""]","{""1,A"": 4, ""1,B"": 2, ""1,C"": 2, ""1,D"": 5}",1,8,67,0,o1-mini,
2025-02-10 17:33:00,test,5,4,"[""A"", ""B"", ""C"", ""D""]","{""A"": 21, ""B"": 6, ""C"": 3, ""D"": 0}","{""1"": {""A"": 4, ""B"": 5, ""C"": 2, ""D"": 1}, ""2"": {""A"": 1, ""B"": 4, ""C"": 5, ""D"": 1}, ""3"": {""A"": 3, ""B"": 4, ""C"": 4, ""D"": 4}, ""4"": {""A"": 1, ""B"": 5, ""C"": 3, ""D"": 1}, ""5"": {""A"": 4, ""B"": 5, ""C"": 2, ""D"": 4}}",False,,,"[""```json\n{\n  \""explanation\"": \""since no information about the baskets has been revealed yet, it's prudent to gather some initial data to make an informed decision. by revealing a few cells from different baskets, i can assess the distribution of prizes and identify which basket has the highest potential payout.\"",\n  \""decision\"": \""reveal\"",\n  \""parameters\"": [\""1 a\"", \""2 b\"", \""3 c\""]\n}\n```"", ""revealed 1 A"", ""revealed 2 B"", ""revealed 3 C"", ""```json\n{\n  \""explanation\"": \""basket 1 already has a significant number of high-value a prizes revealed. to better assess its potential payout, it's beneficial to reveal another cell from basket 1. this will help determine whether basket 1 has more a prizes, further reinforcing its potential as the optimal choice, or if it has fewer, allowing comparison with other baskets.\"",\n  \""decision\"": \""reveal\"",\n  \""parameters\"": [\""1 a\""]\n}\n```"", ""```json\n{\n  \""explanation\"": \""basket 1 has a high-value a prize revealed (4 prizes worth 21 points each), totaling 84 points. however, to ensure that basket 1 consistently offers a high payout, it's important to gather more information about its remaining prizes. revealing additional cells in basket 1 will help assess whether it continues to contain more a prizes or if its payout potential is limited. this will allow for a more informed decision when choosing a basket.\"",\n  \""decision\"": \""reveal\"",\n  \""parameters\"": [\""1 a\"", \""1 a\""]\n}\n```"", ""Exceeded wrong move threshold.""]","{""1,A"": 4, ""2,B"": 4, ""3,C"": 4}",,0,,3,o1-mini,Exceeded wrong move threshold
2025-02-10 17:33:36,test,5,3,"[""A"", ""B"", ""C""]","{""A"": 10, ""B"": 2, ""C"": 18}","{""1"": {""A"": 5, ""B"": 2, ""C"": 4}, ""2"": {""A"": 3, ""B"": 3, ""C"": 1}, ""3"": {""A"": 2, ""B"": 1, ""C"": 5}, ""4"": {""A"": 1, ""B"": 3, ""C"": 4}, ""5"": {""A"": 5, ""B"": 1, ""C"": 4}}",True,1,1,"[""```json\n{\n  \""explanation\"": \""to make a more informed decision, i will reveal some prizes in the recommended basket 1. this will help assess its potential value before deciding to accept it.\"",\n  \""decision\"": \""reveal\"",\n  \""parameters\"": [\""1 a\"", \""1 b\""]\n}\n```"", ""revealed 1 A"", ""revealed 1 B"", ""```json\n{\n  \""explanation\"": \""basket 1 has revealed a strong combination of high-value prizes so far. to maximize the payout and avoid additional reveal costs, it is optimal to accept the recommended basket 1 at this point.\"",\n  \""decision\"": \""accept\"",\n  \""parameters\"": []\n}\n```"", ""accepted default basket 1""]","{""1,A"": 5, ""1,B"": 2}",1,4,122,0,o1-mini,
2025-02-10 17:34:29,test,3,5,"[""A"", ""B"", ""C"", ""D"", ""E""]","{""A"": 7, ""B"": 7, ""C"": 2, ""D"": 9, ""E"": 5}","{""1"": {""A"": 4, ""B"": 3, ""C"": 5, ""D"": 1, ""E"": 1}, ""2"": {""A"": 1, ""B"": 4, ""C"": 3, ""D"": 1, ""E"": 4}, ""3"": {""A"": 1, ""B"": 2, ""C"": 4, ""D"": 5, ""E"": 5}}",False,,,"[""```json\n{\n  \""explanation\"": \""since no information about the baskets has been revealed yet, it's prudent to reveal a few cells to gather initial data on the distribution of prizes. revealing one prize type from each basket will provide a baseline to inform future decisions.\"",\n  \""decision\"": \""reveal\"",\n  \""parameters\"": [\""1 a\"", \""2 a\"", \""3 a\""]\n}\n```"", ""revealed 1 A"", ""revealed 2 A"", ""revealed 3 A"", ""```json\n{\n  \""explanation\"": \""basket 1 has revealed 4 a-type prizes, which is significantly higher than baskets 2 and 3, each revealing only 1 a-type prize. this suggests that basket 1 may have a higher concentration of valuable prizes. to make a more informed decision, it is prudent to reveal additional cells in basket 1 to gather more information about other prize types and better assess its overall payout potential.\"",\n  \""decision\"": \""reveal\"",\n  \""parameters\"": [\""1 b\"", \""1 c\"", \""1 d\""]\n}\n```"", ""revealed 1 B"", ""revealed 1 C"", ""revealed 1 D"", ""```json\n{\n  \""explanation\"": \""basket 1 has a significantly higher number of revealed prizes across multiple types (a:4, b:3, c:5, d:1) compared to baskets 2 and 3, which each have only 1 prize of type a revealed. this suggests that basket 1 likely has a higher total payout potential. given the current information, it is optimal to accept the recommended basket, which is basket 1.\"",\n  \""decision\"": \""accept\"",\n  \""parameters\"": []\n}\n```""]","{""1,A"": 4, ""2,A"": 1, ""3,A"": 1, ""1,B"": 3, ""1,C"": 5, ""1,D"": 1}",,0,,0,o1-mini,Unknown command
2025-02-10 17:35:29,test,4,6,"[""A"", ""B"", ""C"", ""D"", ""E"", ""F""]","{""A"": 7, ""B"": 5, ""C"": 1, ""D"": 14, ""E"": 2, ""F"": 1}","{""1"": {""A"": 5, ""B"": 2, ""C"": 1, ""D"": 3, ""E"": 3, ""F"": 5}, ""2"": {""A"": 2, ""B"": 4, ""C"": 2, ""D"": 1, ""E"": 1, ""F"": 1}, ""3"": {""A"": 4, ""B"": 1, ""C"": 2, ""D"": 1, ""E"": 2, ""F"": 4}, ""4"": {""A"": 4, ""B"": 2, ""C"": 2, ""D"": 2, ""E"": 1, ""F"": 2}}",False,,1,"[""```json\n{\n  \""explanation\"": \""since no information has been revealed for any of the baskets, it's important to gather some data to make an informed decision. revealing one prize type from each basket will help estimate their potential payouts based on the revealed prizes.\"",\n  \""decision\"": \""reveal\"",\n  \""parameters\"": [\""1 a\"", \""2 b\"", \""3 c\"", \""4 d\""]\n}\n```"", ""revealed 1 A"", ""revealed 2 B"", ""revealed 3 C"", ""revealed 4 D"", ""```json\n{\n  \""explanation\"": \""with initial information revealed for each basket, it's beneficial to gather more data to better estimate their potential payouts before making a decision. revealing additional prize types for each basket will provide a clearer picture of their prize distributions and help in selecting the optimal basket.\"",\n  \""decision\"": \""reveal\"",\n  \""parameters\"": [\""1 b\"", \""2 c\"", \""3 a\"", \""4 e\""]\n}\n```"", ""revealed 1 B"", ""revealed 2 C"", ""revealed 3 A"", ""revealed 4 E"", ""```json\n{\n  \""explanation\"": \""having revealed some prize types for each basket, it's advantageous to uncover additional high-value prize types to better estimate each basket's potential payout. by revealing prize types d and a where applicable, we can gain more insight into the higher point contributions of each basket, aiding in making an informed selection.\"",\n  \""decision\"": \""reveal\"",\n  \""parameters\"": [\""1 d\"", \""2 a\"", \""3 d\"", \""4 a\""]\n}\n```"", ""revealed 1 D"", ""revealed 2 A"", ""revealed 3 D"", ""revealed 4 A"", ""```json\n{\n  \""explanation\"": \""based on the revealed prizes, basket 1 currently has the highest accumulated points (87 points) compared to the other baskets. although there are still some prizes hidden, basket 1's strong performance in high-value prize types (a and d) suggests it is likely to provide the highest payout. therefore, it's optimal to choose basket 1 now to secure the best possible outcome.\"",\n  \""decision\"": \""choose\"",\n  \""parameters\"": [1]\n}\n```"", ""chose basket 1""]","{""1,A"": 5, ""2,B"": 4, ""3,C"": 2, ""4,D"": 2, ""1,B"": 2, ""2,C"": 2, ""3,A"": 4, ""4,E"": 1, ""1,D"": 3, ""2,A"": 2, ""3,D"": 1, ""4,A"": 4}",1,24,75,0,o1-mini,
2025-02-10 17:36:56,test,4,5,"[""A"", ""B"", ""C"", ""D"", ""E""]","{""A"": 0, ""B"": 2, ""C"": 1, ""D"": 25, ""E"": 2}","{""1"": {""A"": 2, ""B"": 3, ""C"": 1, ""D"": 5, ""E"": 4}, ""2"": {""A"": 5, ""B"": 1, ""C"": 1, ""D"": 3, ""E"": 4}, ""3"": {""A"": 3, ""B"": 1, ""C"": 3, ""D"": 4, ""E"": 4}, ""4"": {""A"": 2, ""B"": 4, ""C"": 3, ""D"": 2, ""E"": 3}}",True,1,1,"[""```json\n{\n  \""explanation\"": \""since no prizes have been revealed yet and the recommended basket is basket 1 based on the highest total prize count, accepting the recommendation minimizes the risk of incurring costs from revealing cells. this strategy leverages the recommended basket's potential for a higher aggregate payout without additional information.\"",\n  \""decision\"": \""accept\"",\n  \""parameters\"": []\n}\n```"", ""accepted default basket 1""]",{},1,0,140,0,o1-mini,
2025-02-10 17:37:08,test,3,3,"[""A"", ""B"", ""C""]","{""A"": 6, ""B"": 14, ""C"": 10}","{""1"": {""A"": 1, ""B"": 2, ""C"": 1}, ""2"": {""A"": 4, ""B"": 4, ""C"": 1}, ""3"": {""A"": 3, ""B"": 3, ""C"": 3}}",True,2,2,"[""```json\n{\n  \""explanation\"": \""since no boxes have been revealed yet and basket 2 is recommended as the highest-paying based on the total count of prizes, accepting the recommended basket minimizes the risk of incurring additional costs from revealing boxes. without prior information suggesting basket 2 is suboptimal, accepting it is the most efficient decision to maximize the expected payout.\"",\n  \""decision\"": \""accept\"",\n  \""parameters\"": [2]\n}\n```"", ""accepted default basket 2""]",{},2,0,90,0,o1-mini,
2025-02-10 17:37:21,test,4,4,"[""A"", ""B"", ""C"", ""D""]","{""A"": 7, ""B"": 14, ""C"": 1, ""D"": 8}","{""1"": {""A"": 3, ""B"": 3, ""C"": 1, ""D"": 2}, ""2"": {""A"": 3, ""B"": 2, ""C"": 4, ""D"": 3}, ""3"": {""A"": 4, ""B"": 3, ""C"": 1, ""D"": 1}, ""4"": {""A"": 4, ""B"": 2, ""C"": 4, ""D"": 4}}",False,,4,"[""```json\n{\n  \""explanation\"": \""all baskets are currently unrevealed and have an equal expected number of prizes. to make an informed decision, revealing some cells will provide more information about the prize distribution in the baskets. therefore, i choose to reveal prize types a and b in basket 1.\"",\n  \""decision\"": \""reveal\"",\n  \""parameters\"": [\""1 a\"", \""1 b\""]\n}\n```"", ""revealed 1 A"", ""revealed 1 B"", ""```json\n{\n  \""explanation\"": \""basket 1 has revealed a significant number of high-value prizes (a: 3 and b: 3). to accurately assess its total payout, it's beneficial to reveal the remaining prize types (c and d). this will provide a complete understanding of basket 1's value, allowing for a more informed decision on whether to choose it or explore other baskets.\"",\n  \""decision\"": \""reveal\"",\n  \""parameters\"": [\""1 c\"", \""1 d\""]\n}\n```"", ""revealed 1 C"", ""revealed 1 D"", ""```json\n{\n  \""explanation\"": \""basket 1 has revealed a substantial number of high-value prizes (a:3 and b:3) along with some additional prizes (c:1 and d:2). given the significant points accumulated from basket 1 and the fact that the other baskets remain entirely unrevealed with an expected average, it is optimal to choose basket 1 to maximize the payout while minimizing further costs.\"",\n  \""decision\"": \""choose\"",\n  \""parameters\"": [1]\n}\n```"", ""chose basket 1""]","{""1,A"": 3, ""1,B"": 3, ""1,C"": 1, ""1,D"": 2}",1,8,72,0,o1-mini,
2025-02-10 18:03:30,test,7,3,"[""A"", ""B"", ""C""]","{""A"": 12, ""B"": 9, ""C"": 9}","{""1"": {""A"": 5, ""B"": 3, ""C"": 2}, ""2"": {""A"": 1, ""B"": 4, ""C"": 3}, ""3"": {""A"": 4, ""B"": 1, ""C"": 2}, ""4"": {""A"": 5, ""B"": 3, ""C"": 2}, ""5"": {""A"": 1, ""B"": 4, ""C"": 1}, ""6"": {""A"": 3, ""B"": 2, ""C"": 1}, ""7"": {""A"": 3, ""B"": 3, ""C"": 3}}",True,1,1,"[""{\n  \""explanation\"": \""the recommended basket is basket 1, which is optimal since it is the highest-paying basket based on the total count of prizes. given that all baskets currently show no revealed prizes, accepting the recommended basket is the best course of action to maximize potential points.\"",\n  \""decision\"": \""accept\"",\n  \""parameters\"": []\n}"", ""accepted default basket 1""]",{},1,0,105,0,gpt-4o-mini,
2025-02-10 18:03:32,test,4,5,"[""A"", ""B"", ""C"", ""D"", ""E""]","{""A"": 0, ""B"": 5, ""C"": 11, ""D"": 8, ""E"": 6}","{""1"": {""A"": 4, ""B"": 1, ""C"": 1, ""D"": 4, ""E"": 3}, ""2"": {""A"": 2, ""B"": 3, ""C"": 3, ""D"": 3, ""E"": 1}, ""3"": {""A"": 1, ""B"": 1, ""C"": 4, ""D"": 1, ""E"": 5}, ""4"": {""A"": 1, ""B"": 2, ""C"": 4, ""D"": 3, ""E"": 1}}",False,,3,"[""{\n  \""explanation\"": \""in the current game state, we have the following prize distribution across the baskets: basket 1 has 0 points in a, 5 in b, 11 in c, 8 in d, and 6 in e. since a has no points, it does not contribute to the total. the total points for basket 1 can be calculated as (5 * 5) + (11 * 11) + (8 * 8) + (6 * 6) = 25 + 121 + 64 + 36 = 246 points. the other baskets have not been revealed, but since basket 1 has a significant number of high-value prizes, it is reasonable to choose it directly rather than revealing more boxes. therefore, i will choose basket 1.\"",\n  \""decision\"": \""choose\"",\n  \""parameters\"": [1]\n}"", ""chose basket 1""]",{},1,0,66,0,gpt-4o-mini,
