timestamp,round_type,num_baskets,num_prize_types,prize_labels,prize_values,basket_counts,nudge_present,default_basket,best_basket,action_log,revealed_cells,final_choice,total_reveal_cost,points_earned,wrong_moves,model_used,error
2025-02-10 18:08:07,test,4,5,"[""A"", ""B"", ""C"", ""D"", ""E""]","{""A"": 0, ""B"": 1, ""C"": 6, ""D"": 19, ""E"": 4}","{""1"": {""A"": 2, ""B"": 2, ""C"": 1, ""D"": 1, ""E"": 3}, ""2"": {""A"": 1, ""B"": 4, ""C"": 4, ""D"": 1, ""E"": 4}, ""3"": {""A"": 3, ""B"": 2, ""C"": 5, ""D"": 1, ""E"": 1}, ""4"": {""A"": 1, ""B"": 3, ""C"": 5, ""D"": 4, ""E"": 3}}",False,,4,"[""```json\n{\n  \""explanation\"": \""since all baskets are currently unrevealed, i need to gather more information about the prize distribution to make an informed decision. revealing a few cells will help me understand which basket might have the highest value based on the prize types and their respective points. i will start by revealing one cell from each basket to get an initial sense of the prize distribution.\"",\n  \""decision\"": \""reveal\"",\n  \""parameters\"": [\""1 a\"", \""2 a\"", \""3 a\"", \""4 a\""]\n}\n```"", ""revealed 1 A"", ""revealed 2 A"", ""revealed 3 A"", ""revealed 4 A"", ""```json\n{\n  \""explanation\"": \""the initial reveal shows that basket 3 has the highest number of a prizes, but since a prizes are worth 0 points, this information is not useful for determining the best basket. to make a more informed decision, i need to reveal cells associated with higher point values. i will reveal the b prizes next, as they have a low point value, allowing me to gather more information without a significant cost.\"",\n  \""decision\"": \""reveal\"",\n  \""parameters\"": [\""1 b\"", \""2 b\"", \""3 b\"", \""4 b\""]\n}\n```"", ""revealed 1 B"", ""revealed 2 B"", ""revealed 3 B"", ""revealed 4 B"", ""```json\n{\n  \""explanation\"": \""after revealing the b prizes, basket 2 has the highest number of b prizes, but since b prizes are worth only 1 point each, this is not a significant factor. to better assess the potential value of each basket, i will now reveal the c prizes, as they have a higher point value of 6 points each. this will help me identify which basket might have a higher total value.\"",\n  \""decision\"": \""reveal\"",\n  \""parameters\"": [\""1 c\"", \""2 c\"", \""3 c\"", \""4 c\""]\n}\n```"", ""revealed 1 C"", ""revealed 2 C"", ""revealed 3 C"", ""revealed 4 C"", ""```json\n{\n  \""explanation\"": \""after revealing the c prizes, baskets 3 and 4 have the highest number of c prizes, which are worth 6 points each. basket 3 has 5 c prizes and basket 4 also has 5 c prizes. however, to make a more informed decision, i need to reveal the d prizes, as they have the highest point value of 19 points each. this will help me determine which basket has the potential for the highest payout.\"",\n  \""decision\"": \""reveal\"",\n  \""parameters\"": [\""1 d\"", \""2 d\"", \""3 d\"", \""4 d\""]\n}\n```"", ""revealed 1 D"", ""revealed 2 D"", ""revealed 3 D"", ""revealed 4 D"", ""```json\n{\n  \""explanation\"": \""after revealing the d prizes, basket 4 stands out with 4 d prizes, each worth 19 points, giving it a significant potential value. basket 4 also has a good number of c prizes, which are worth 6 points each. given the high value of the d prizes in basket 4, it is likely to have the highest total payout. therefore, i will choose basket 4.\"",\n  \""decision\"": \""choose\"",\n  \""parameters\"": [4]\n}\n```"", ""chose basket 4""]","{""1,A"": 2, ""2,A"": 1, ""3,A"": 3, ""4,A"": 1, ""1,B"": 2, ""2,B"": 4, ""3,B"": 2, ""4,B"": 3, ""1,C"": 1, ""2,C"": 4, ""3,C"": 5, ""4,C"": 5, ""1,D"": 1, ""2,D"": 1, ""3,D"": 1, ""4,D"": 4}",4,32,89,0,gpt-4o,
2025-02-10 18:08:25,test,4,6,"[""A"", ""B"", ""C"", ""D"", ""E"", ""F""]","{""A"": 7, ""B"": 2, ""C"": 15, ""D"": 2, ""E"": 2, ""F"": 2}","{""1"": {""A"": 4, ""B"": 5, ""C"": 2, ""D"": 3, ""E"": 2, ""F"": 2}, ""2"": {""A"": 4, ""B"": 5, ""C"": 5, ""D"": 1, ""E"": 5, ""F"": 4}, ""3"": {""A"": 1, ""B"": 4, ""C"": 4, ""D"": 1, ""E"": 5, ""F"": 2}, ""4"": {""A"": 3, ""B"": 5, ""C"": 5, ""D"": 2, ""E"": 3, ""F"": 3}}",True,2,2,"[""```json\n{\n  \""explanation\"": \""the recommended basket is basket 2, which is suggested based on the total count of prizes without considering their point values. however, given the point distribution, prize type c is significantly more valuable than the others. since i have no information about the distribution of prizes in any of the baskets, revealing some boxes could provide insight into which basket might have a higher count of the more valuable prize type c. this will help in making a more informed decision.\"",\n  \""decision\"": \""reveal\"",\n  \""parameters\"": [\""1 a\"", \""2 a\"", \""3 a\"", \""4 a\""]\n}\n```"", ""revealed 1 A"", ""revealed 2 A"", ""revealed 3 A"", ""revealed 4 A"", ""```json\n{\n  \""explanation\"": \""i have revealed the number of prize type a in each basket, but this information alone is insufficient to determine the best basket since prize type c is the most valuable. to make a more informed decision, i should reveal the number of prize type c in each basket, as it has the highest point value and will significantly impact the total payout.\"",\n  \""decision\"": \""reveal\"",\n  \""parameters\"": [\""1 c\"", \""2 c\"", \""3 c\"", \""4 c\""]\n}\n```"", ""revealed 1 C"", ""revealed 2 C"", ""revealed 3 C"", ""revealed 4 C"", ""```json\n{\n  \""explanation\"": \""after revealing the counts of prize types a and c, we see that basket 2 and basket 4 both have the highest count of the most valuable prize type c (5 each). however, basket 2 also has a higher count of prize type a compared to basket 4. given the high value of prize type c and the decent count of prize type a in basket 2, it seems to be the optimal choice. therefore, i will accept the recommended basket 2.\"",\n  \""decision\"": \""accept\"",\n  \""parameters\"": []\n}\n```"", ""accepted default basket 2""]","{""1,A"": 4, ""2,A"": 4, ""3,A"": 1, ""4,A"": 3, ""1,C"": 2, ""2,C"": 5, ""3,C"": 4, ""4,C"": 5}",2,16,117,0,gpt-4o,
2025-02-10 18:08:36,test,7,3,"[""A"", ""B"", ""C""]","{""A"": 19, ""B"": 11, ""C"": 0}","{""1"": {""A"": 1, ""B"": 4, ""C"": 2}, ""2"": {""A"": 1, ""B"": 3, ""C"": 3}, ""3"": {""A"": 2, ""B"": 4, ""C"": 1}, ""4"": {""A"": 4, ""B"": 3, ""C"": 2}, ""5"": {""A"": 4, ""B"": 5, ""C"": 4}, ""6"": {""A"": 4, ""B"": 2, ""C"": 1}, ""7"": {""A"": 3, ""B"": 3, ""C"": 4}}",False,,5,"[""```json\n{\n  \""explanation\"": \""given the prize values, type a is worth 19 points, type b is worth 11 points, and type c is worth 0 points. since type c has no value, it is irrelevant to our decision. the total point value of all prizes is 30, which means type a and b are the only contributors. without any revealed information, we cannot determine the distribution of prizes across baskets. therefore, it is beneficial to reveal some boxes to gather information about the distribution of high-value prizes (a and b) before making a decision.\"",\n  \""decision\"": \""reveal\"",\n  \""parameters\"": [\""1 a\"", \""2 a\"", \""3 a\""]\n}\n```"", ""revealed 1 A"", ""revealed 2 A"", ""revealed 3 A"", ""```json\n{\n  \""explanation\"": \""we have revealed some information about prize type a in baskets 1, 2, and 3. basket 3 currently has the highest number of type a prizes, which are the most valuable. however, we still have no information about type b prizes, which also contribute significantly to the total score. to make a more informed decision, it would be beneficial to reveal some type b prizes to understand their distribution across the baskets.\"",\n  \""decision\"": \""reveal\"",\n  \""parameters\"": [\""1 b\"", \""2 b\"", \""3 b\""]\n}\n```"", ""revealed 1 B"", ""revealed 2 B"", ""revealed 3 B"", ""```json\n{\n  \""explanation\"": \""we have now revealed the number of type a and type b prizes in baskets 1, 2, and 3. basket 3 has the highest number of type a prizes (2) and is tied with basket 1 for the highest number of type b prizes (4). calculating the potential scores: basket 1 offers 1*19 + 4*11 = 63 points, basket 2 offers 1*19 + 3*11 = 52 points, and basket 3 offers 2*19 + 4*11 = 86 points. since revealing costs 2 points per cell, we have already spent 12 points on reveals. basket 3 offers the highest potential score, even after accounting for the reveal cost, so it is optimal to choose basket 3.\"",\n  \""decision\"": \""choose\"",\n  \""parameters\"": [3]\n}\n```"", ""chose basket 3""]","{""1,A"": 1, ""2,A"": 1, ""3,A"": 2, ""1,B"": 4, ""2,B"": 3, ""3,B"": 4}",3,12,70,0,gpt-4o,
2025-02-10 18:08:47,test,4,5,"[""A"", ""B"", ""C"", ""D"", ""E""]","{""A"": 6, ""B"": 15, ""C"": 2, ""D"": 7, ""E"": 0}","{""1"": {""A"": 2, ""B"": 2, ""C"": 5, ""D"": 4, ""E"": 2}, ""2"": {""A"": 5, ""B"": 2, ""C"": 3, ""D"": 2, ""E"": 3}, ""3"": {""A"": 5, ""B"": 4, ""C"": 1, ""D"": 3, ""E"": 4}, ""4"": {""A"": 1, ""B"": 4, ""C"": 4, ""D"": 5, ""E"": 3}}",False,,3,"[""```json\n{\n  \""explanation\"": \""since all baskets are currently unrevealed, i have no information about the distribution of prizes in each basket. the recommended basket is not provided, so i need to gather some information to make an informed decision. i will reveal one cell from each basket to get an initial sense of the prize distribution.\"",\n  \""decision\"": \""reveal\"",\n  \""parameters\"": [\""1 a\"", \""2 a\"", \""3 a\"", \""4 a\""]\n}\n```"", ""revealed 1 A"", ""revealed 2 A"", ""revealed 3 A"", ""revealed 4 A"", ""```json\n{\n  \""explanation\"": \""based on the initial reveal, basket 2 and basket 3 have the highest number of a prizes, which are worth 6 points each. however, this is not enough information to make a decision, as the distribution of the higher-value b prizes could significantly impact the total payout. i will reveal the b prizes for each basket to gather more information.\"",\n  \""decision\"": \""reveal\"",\n  \""parameters\"": [\""1 b\"", \""2 b\"", \""3 b\"", \""4 b\""]\n}\n```"", ""revealed 1 B"", ""revealed 2 B"", ""revealed 3 B"", ""revealed 4 B"", ""```json\n{\n  \""explanation\"": \""after revealing the a and b prizes, basket 3 and basket 4 have the highest number of b prizes, which are worth 15 points each. basket 3 also has a high number of a prizes. to further refine the decision, i will reveal the c prizes, as they could add additional value to the baskets.\"",\n  \""decision\"": \""reveal\"",\n  \""parameters\"": [\""1 c\"", \""2 c\"", \""3 c\"", \""4 c\""]\n}\n```"", ""revealed 1 C"", ""revealed 2 C"", ""revealed 3 C"", ""revealed 4 C"", ""```json\n{\n  \""explanation\"": \""after revealing the a, b, and c prizes, we have a clearer picture of the potential value of each basket. basket 3 has a strong combination of a and b prizes, which are the highest value prizes. basket 4 also has a good number of b prizes, but fewer a prizes. the c prizes add minimal value due to their low point value. given the current information, basket 3 appears to have the highest potential payout. i will choose basket 3.\"",\n  \""decision\"": \""choose\"",\n  \""parameters\"": [3]\n}\n```"", ""chose basket 3""]","{""1,A"": 2, ""2,A"": 5, ""3,A"": 5, ""4,A"": 1, ""1,B"": 2, ""2,B"": 2, ""3,B"": 4, ""4,B"": 4, ""1,C"": 5, ""2,C"": 3, ""3,C"": 1, ""4,C"": 4}",3,24,89,0,gpt-4o,
2025-02-10 18:09:00,test,5,6,"[""A"", ""B"", ""C"", ""D"", ""E"", ""F""]","{""A"": 5, ""B"": 11, ""C"": 7, ""D"": 3, ""E"": 1, ""F"": 3}","{""1"": {""A"": 2, ""B"": 5, ""C"": 3, ""D"": 5, ""E"": 3, ""F"": 3}, ""2"": {""A"": 5, ""B"": 5, ""C"": 3, ""D"": 4, ""E"": 1, ""F"": 5}, ""3"": {""A"": 3, ""B"": 3, ""C"": 4, ""D"": 3, ""E"": 3, ""F"": 5}, ""4"": {""A"": 4, ""B"": 2, ""C"": 2, ""D"": 4, ""E"": 3, ""F"": 2}, ""5"": {""A"": 4, ""B"": 2, ""C"": 3, ""D"": 2, ""E"": 1, ""F"": 3}}",True,2,2,"[""```json\n{\n  \""explanation\"": \""given that the recommended basket is based on the total count of prizes, it is likely to have a high number of prizes overall. however, the point values for each prize type vary significantly, with type b having the highest value at 11 points. without any revealed information, it's uncertain if the recommended basket is optimal in terms of point value. to make a more informed decision, i will reveal a few boxes from basket 2 to assess the distribution of high-value prizes, particularly focusing on prize type b.\"",\n  \""decision\"": \""reveal\"",\n  \""parameters\"": [\""2 a\"", \""2 b\"", \""2 c\""]\n}\n```"", ""revealed 2 A"", ""revealed 2 B"", ""revealed 2 C"", ""```json\n{\n  \""explanation\"": \""after revealing some boxes in basket 2, we have found that it contains 5 prizes of type a, 5 prizes of type b, and 3 prizes of type c. type b has the highest point value at 11 points, and basket 2 already has a significant number of these high-value prizes. given this information, basket 2 seems to be a strong candidate for selection, especially since it was also the recommended basket based on total prize count. therefore, i will accept the recommended basket.\"",\n  \""decision\"": \""accept\"",\n  \""parameters\"": []\n}\n```"", ""accepted default basket 2""]","{""2,A"": 5, ""2,B"": 5, ""2,C"": 3}",2,6,123,0,gpt-4o,
2025-02-10 18:09:08,test,5,5,"[""A"", ""B"", ""C"", ""D"", ""E""]","{""A"": 1, ""B"": 7, ""C"": 4, ""D"": 10, ""E"": 8}","{""1"": {""A"": 3, ""B"": 4, ""C"": 4, ""D"": 5, ""E"": 2}, ""2"": {""A"": 1, ""B"": 1, ""C"": 1, ""D"": 3, ""E"": 2}, ""3"": {""A"": 3, ""B"": 2, ""C"": 4, ""D"": 2, ""E"": 2}, ""4"": {""A"": 1, ""B"": 5, ""C"": 4, ""D"": 1, ""E"": 3}, ""5"": {""A"": 1, ""B"": 1, ""C"": 2, ""D"": 3, ""E"": 2}}",False,,1,"[""```json\n{\n  \""explanation\"": \""given that each basket has hidden prizes and the cost of revealing each cell is 2 points, it is important to gather some information before making a decision. since there are five types of prizes with varying point values, revealing a few cells can help estimate which basket might have the highest payout. i will reveal one cell from each basket to get an initial sense of the prize distribution.\"",\n  \""decision\"": \""reveal\"",\n  \""parameters\"": [\""1 a\"", \""2 a\"", \""3 a\"", \""4 a\"", \""5 a\""]\n}\n```"", ""revealed 1 A"", ""revealed 2 A"", ""revealed 3 A"", ""revealed 4 A"", ""revealed 5 A"", ""```json\n{\n  \""explanation\"": \""after revealing the number of a-type prizes in each basket, we have some initial information. basket 1 and basket 3 have more a-type prizes, but since a-type prizes are only worth 1 point each, this information alone is not sufficient to make a decision. to better assess the potential payout, i will reveal the b-type prizes, which have a higher point value of 7 points each, to see if there is a significant difference among the baskets.\"",\n  \""decision\"": \""reveal\"",\n  \""parameters\"": [\""1 b\"", \""2 b\"", \""3 b\"", \""4 b\"", \""5 b\""]\n}\n```"", ""revealed 1 B"", ""revealed 2 B"", ""revealed 3 B"", ""revealed 4 B"", ""revealed 5 B"", ""```json\n{\n  \""explanation\"": \""after revealing the b-type prizes, basket 4 stands out with 5 b-type prizes, which are worth 7 points each. this gives basket 4 a significant potential advantage in terms of points. basket 1 also has a good number of b-type prizes, but basket 4 has the highest count. given the current information, basket 4 seems to have the highest potential payout. i will choose basket 4.\"",\n  \""decision\"": \""choose\"",\n  \""parameters\"": [4]\n}\n```"", ""chose basket 4""]","{""1,A"": 3, ""2,A"": 1, ""3,A"": 3, ""4,A"": 1, ""5,A"": 1, ""1,B"": 4, ""2,B"": 1, ""3,B"": 2, ""4,B"": 5, ""5,B"": 1}",4,20,66,0,gpt-4o,
2025-02-10 18:09:19,test,4,5,"[""A"", ""B"", ""C"", ""D"", ""E""]","{""A"": 10, ""B"": 4, ""C"": 2, ""D"": 2, ""E"": 12}","{""1"": {""A"": 1, ""B"": 5, ""C"": 2, ""D"": 5, ""E"": 4}, ""2"": {""A"": 3, ""B"": 3, ""C"": 5, ""D"": 4, ""E"": 2}, ""3"": {""A"": 3, ""B"": 4, ""C"": 5, ""D"": 5, ""E"": 5}, ""4"": {""A"": 3, ""B"": 3, ""C"": 5, ""D"": 4, ""E"": 3}}",False,,3,"[""```json\n{\n  \""explanation\"": \""since all baskets are currently unrevealed, i need to gather more information about the contents of the baskets to make an informed decision. revealing a few cells will help estimate the potential payout of each basket. i will start by revealing one cell from each basket to get a sense of the distribution of prizes.\"",\n  \""decision\"": \""reveal\"",\n  \""parameters\"": [\""1 a\"", \""2 a\"", \""3 a\"", \""4 a\""]\n}\n```"", ""revealed 1 A"", ""revealed 2 A"", ""revealed 3 A"", ""revealed 4 A"", ""```json\n{\n  \""explanation\"": \""i have revealed the number of 'a' prizes in each basket. basket 2, 3, and 4 have 3 'a' prizes, while basket 1 has only 1. since 'a' prizes are worth 10 points each, baskets 2, 3, and 4 currently have a higher potential value from 'a' prizes alone. to further differentiate between these baskets, i will reveal the 'b' prize in each basket, as it has the next highest point value.\"",\n  \""decision\"": \""reveal\"",\n  \""parameters\"": [\""1 b\"", \""2 b\"", \""3 b\"", \""4 b\""]\n}\n```"", ""revealed 1 B"", ""revealed 2 B"", ""revealed 3 B"", ""revealed 4 B"", ""```json\n{\n  \""explanation\"": \""after revealing the 'a' and 'b' prizes, basket 1 has 1 'a' and 5 'b' prizes, basket 2 has 3 'a' and 3 'b' prizes, basket 3 has 3 'a' and 4 'b' prizes, and basket 4 has 3 'a' and 3 'b' prizes. calculating the current known values: basket 1 has 1*10 + 5*4 = 30 points, basket 2 has 3*10 + 3*4 = 42 points, basket 3 has 3*10 + 4*4 = 46 points, and basket 4 has 3*10 + 3*4 = 42 points. basket 3 currently has the highest known value. to confirm this, i will reveal the 'c' prize in each basket, as it has the next highest point value.\"",\n  \""decision\"": \""reveal\"",\n  \""parameters\"": [\""1 c\"", \""2 c\"", \""3 c\"", \""4 c\""]\n}\n```"", ""revealed 1 C"", ""revealed 2 C"", ""revealed 3 C"", ""revealed 4 C"", ""```json\n{\n  \""explanation\"": \""after revealing the 'c' prizes, basket 1 has 2 'c' prizes, basket 2 has 5 'c' prizes, basket 3 has 5 'c' prizes, and basket 4 has 5 'c' prizes. calculating the current known values: basket 1 has 30 + 2*2 = 34 points, basket 2 has 42 + 5*2 = 52 points, basket 3 has 46 + 5*2 = 56 points, and basket 4 has 42 + 5*2 = 52 points. basket 3 still has the highest known value. i will now reveal the 'd' prize in each basket to further confirm the optimal choice.\"",\n  \""decision\"": \""reveal\"",\n  \""parameters\"": [\""1 d\"", \""2 d\"", \""3 d\"", \""4 d\""]\n}\n```"", ""revealed 1 D"", ""revealed 2 D"", ""revealed 3 D"", ""revealed 4 D"", ""```json\n{\n  \""explanation\"": \""after revealing the 'd' prizes, basket 1 has 5 'd' prizes, basket 2 has 4 'd' prizes, basket 3 has 5 'd' prizes, and basket 4 has 4 'd' prizes. calculating the current known values: basket 1 has 34 + 5*2 = 44 points, basket 2 has 52 + 4*2 = 60 points, basket 3 has 56 + 5*2 = 66 points, and basket 4 has 52 + 4*2 = 60 points. basket 3 still has the highest known value. i will now reveal the 'e' prize in each basket to finalize the decision.\"",\n  \""decision\"": \""reveal\"",\n  \""parameters\"": [\""1 e\"", \""2 e\"", \""3 e\"", \""4 e\""]\n}\n```"", ""revealed 1 E"", ""revealed 2 E"", ""revealed 3 E"", ""revealed 4 E"", ""```json\n{\n  \""explanation\"": \""after revealing all prize types, the total points for each basket are as follows: basket 1 has 44 + 4*12 = 92 points, basket 2 has 60 + 2*12 = 84 points, basket 3 has 66 + 5*12 = 126 points, and basket 4 has 60 + 3*12 = 96 points. basket 3 has the highest total value. since revealing all cells incurs a cost of 20 points, the net values are: basket 1 = 72, basket 2 = 64, basket 3 = 106, basket 4 = 76. basket 3 remains the optimal choice.\"",\n  \""decision\"": \""choose\"",\n  \""parameters\"": [3]\n}\n```"", ""chose basket 3""]","{""1,A"": 1, ""2,A"": 3, ""3,A"": 3, ""4,A"": 3, ""1,B"": 5, ""2,B"": 3, ""3,B"": 4, ""4,B"": 3, ""1,C"": 2, ""2,C"": 5, ""3,C"": 5, ""4,C"": 5, ""1,D"": 5, ""2,D"": 4, ""3,D"": 5, ""4,D"": 4, ""1,E"": 4, ""2,E"": 2, ""3,E"": 5, ""4,E"": 3}",3,40,86,0,gpt-4o,
2025-02-10 18:09:55,test,7,6,"[""A"", ""B"", ""C"", ""D"", ""E"", ""F""]","{""A"": 1, ""B"": 7, ""C"": 5, ""D"": 1, ""E"": 4, ""F"": 12}","{""1"": {""A"": 3, ""B"": 1, ""C"": 2, ""D"": 1, ""E"": 1, ""F"": 3}, ""2"": {""A"": 1, ""B"": 4, ""C"": 2, ""D"": 2, ""E"": 5, ""F"": 2}, ""3"": {""A"": 1, ""B"": 2, ""C"": 1, ""D"": 3, ""E"": 1, ""F"": 5}, ""4"": {""A"": 5, ""B"": 1, ""C"": 4, ""D"": 5, ""E"": 1, ""F"": 1}, ""5"": {""A"": 3, ""B"": 4, ""C"": 3, ""D"": 2, ""E"": 5, ""F"": 3}, ""6"": {""A"": 1, ""B"": 3, ""C"": 2, ""D"": 4, ""E"": 1, ""F"": 5}, ""7"": {""A"": 2, ""B"": 4, ""C"": 1, ""D"": 2, ""E"": 4, ""F"": 3}}",True,5,5,"[""```json\n{\n  \""explanation\"": \""given the current game state, all baskets are unrevealed, and the recommended basket is basket 5. the recommendation is based on the total count of prizes, not their point values. since the point values vary significantly across prize types, it would be prudent to reveal some boxes to gather more information about the distribution of high-value prizes, particularly type f which is worth 12 points. this will help in making a more informed decision.\"",\n  \""decision\"": \""reveal\"",\n  \""parameters\"": [\""5 a\"", \""5 b\"", \""5 c\"", \""5 d\"", \""5 e\"", \""5 f\""]\n}\n```"", ""revealed 5 A"", ""revealed 5 B"", ""revealed 5 C"", ""revealed 5 D"", ""revealed 5 E"", ""revealed 5 F"", ""```json\n{\n  \""explanation\"": \""after revealing the contents of basket 5, we have a clear understanding of its prize distribution. basket 5 contains 3 type f prizes, which are the highest value at 12 points each, totaling 36 points just for type f. the other prize types add additional value, making basket 5 a strong candidate. given that the recommended basket is also basket 5 and it has a high value of type f prizes, it is reasonable to accept the recommendation.\"",\n  \""decision\"": \""accept\"",\n  \""parameters\"": []\n}\n```"", ""accepted default basket 5""]","{""5,A"": 3, ""5,B"": 4, ""5,C"": 3, ""5,D"": 2, ""5,E"": 5, ""5,F"": 3}",5,12,92,0,gpt-4o,
2025-02-10 18:10:03,test,3,3,"[""A"", ""B"", ""C""]","{""A"": 14, ""B"": 8, ""C"": 8}","{""1"": {""A"": 5, ""B"": 1, ""C"": 3}, ""2"": {""A"": 1, ""B"": 2, ""C"": 3}, ""3"": {""A"": 3, ""B"": 1, ""C"": 2}}",True,1,1,"[""```json\n{\n  \""explanation\"": \""the recommended basket is basket 1, which is suggested based on the total count of prizes. however, since the prize values vary significantly (a: 14 points, b: 8 points, c: 8 points), it is important to gather more information about the distribution of these prizes in each basket before making a decision. by revealing a few cells, we can better understand the potential payout of each basket and make a more informed choice.\"",\n  \""decision\"": \""reveal\"",\n  \""parameters\"": [\""1 a\"", \""2 a\"", \""3 a\""]\n}\n```"", ""revealed 1 A"", ""revealed 2 A"", ""revealed 3 A"", ""```json\n{\n  \""explanation\"": \""after revealing the number of 'a' prizes in each basket, basket 1 has the highest number of high-value 'a' prizes (5), which contributes significantly to its potential payout. however, to make a more informed decision, it is beneficial to reveal the number of 'b' prizes in each basket, as they also have a substantial point value. this will help determine if any other basket could potentially have a higher payout.\"",\n  \""decision\"": \""reveal\"",\n  \""parameters\"": [\""1 b\"", \""2 b\"", \""3 b\""]\n}\n```"", ""revealed 1 B"", ""revealed 2 B"", ""revealed 3 B"", ""```json\n{\n  \""explanation\"": \""basket 1 has the highest number of high-value 'a' prizes (5) and a reasonable number of 'b' prizes (1). basket 2 has fewer 'a' prizes and only slightly more 'b' prizes, while basket 3 has a moderate number of 'a' prizes and the same number of 'b' prizes as basket 1. given the high value of 'a' prizes, basket 1 is likely to have the highest payout. revealing more 'c' prizes would incur additional costs without significantly altering the decision, as basket 1 already has a strong lead in high-value prizes.\"",\n  \""decision\"": \""choose\"",\n  \""parameters\"": [1]\n}\n```"", ""chose basket 1""]","{""1,A"": 5, ""2,A"": 1, ""3,A"": 3, ""1,B"": 1, ""2,B"": 2, ""3,B"": 1}",1,12,90,0,gpt-4o,
