timestamp,round_type,num_baskets,num_prize_types,prize_labels,prize_values,basket_counts,nudge_present,default_basket,best_basket,action_log,revealed_cells,final_choice,total_reveal_cost,points_earned,wrong_moves,model_used,error
2025-02-10 17:03:24,test,5,3,"[""A"", ""B"", ""C""]","{""A"": 3, ""B"": 19, ""C"": 8}","{""1"": {""A"": 3, ""B"": 4, ""C"": 4}, ""2"": {""A"": 5, ""B"": 2, ""C"": 3}, ""3"": {""A"": 2, ""B"": 2, ""C"": 4}, ""4"": {""A"": 4, ""B"": 2, ""C"": 1}, ""5"": {""A"": 3, ""B"": 2, ""C"": 2}}",True,1,1,"[""{\""explanation\"":\""the recommended basket is basket 1, which has the potential to yield a good payout based on the prize distribution. since there are no revealed prizes yet, i will accept the recommended basket to maximize my potential points without incurring any costs from revealing boxes.\"",\""decision\"":\""accept\"",\""parameters\"":[]}"", ""accepted default basket 1""]",{},1,0,117,0,gpt-4o-mini,
2025-02-10 17:03:25,test,5,4,"[""A"", ""B"", ""C"", ""D""]","{""A"": 8, ""B"": 6, ""C"": 6, ""D"": 10}","{""1"": {""A"": 3, ""B"": 4, ""C"": 2, ""D"": 2}, ""2"": {""A"": 2, ""B"": 3, ""C"": 1, ""D"": 5}, ""3"": {""A"": 4, ""B"": 5, ""C"": 5, ""D"": 4}, ""4"": {""A"": 4, ""B"": 1, ""C"": 1, ""D"": 1}, ""5"": {""A"": 4, ""B"": 3, ""C"": 5, ""D"": 5}}",True,3,3,"[""{\n  \""explanation\"": \""the recommended basket is basket 3, which is suggested based on the highest potential payout when considering all prizes equally. since i have no information about the actual distribution of prizes in any of the baskets, accepting the recommended basket seems to be the best option at this point. it minimizes risk and allows me to proceed with a potentially optimal choice.\"",\n  \""decision\"": \""accept\"",\n  \""parameters\"": []\n}"", ""accepted default basket 3""]",{},3,0,132,0,gpt-4o-mini,
2025-02-10 17:03:32,test,7,3,"[""A"", ""B"", ""C""]","{""A"": 0, ""B"": 24, ""C"": 6}","{""1"": {""A"": 3, ""B"": 3, ""C"": 3}, ""2"": {""A"": 3, ""B"": 3, ""C"": 4}, ""3"": {""A"": 5, ""B"": 2, ""C"": 4}, ""4"": {""A"": 4, ""B"": 5, ""C"": 4}, ""5"": {""A"": 2, ""B"": 3, ""C"": 4}, ""6"": {""A"": 5, ""B"": 1, ""C"": 1}, ""7"": {""A"": 1, ""B"": 4, ""C"": 1}}",True,4,4,"[""{\n  \""explanation\"": \""the recommended basket is basket 4, which i will accept. since there are no prizes of type a and the majority of the points come from type b, which has a high point value, it is likely that this basket will yield a good payout. accepting the recommended basket is optimal as it avoids the cost of revealing boxes and allows me to secure the points based on the current information.\"",\n  \""decision\"": \""accept\"",\n  \""parameters\"": []\n}"", ""accepted default basket 4""]",{},4,0,144,0,gpt-4o-mini,
2025-02-10 17:03:35,test,6,4,"[""A"", ""B"", ""C"", ""D""]","{""A"": 9, ""B"": 19, ""C"": 2, ""D"": 0}","{""1"": {""A"": 2, ""B"": 4, ""C"": 2, ""D"": 4}, ""2"": {""A"": 2, ""B"": 2, ""C"": 4, ""D"": 1}, ""3"": {""A"": 5, ""B"": 4, ""C"": 2, ""D"": 1}, ""4"": {""A"": 5, ""B"": 5, ""C"": 4, ""D"": 4}, ""5"": {""A"": 4, ""B"": 5, ""C"": 2, ""D"": 2}, ""6"": {""A"": 2, ""B"": 4, ""C"": 5, ""D"": 2}}",False,,4,"[""{\n  \""explanation\"": \""in this game state, we have not revealed any boxes yet, and we know the point values of the prizes. the recommended basket is determined by the total count of prizes. since all baskets currently have hidden prizes, i cannot determine which basket is optimal without revealing some boxes. given that the average number of prizes is 5 per type, i will reveal a few boxes to gather more information about the hidden prizes in the baskets. this will help me make a more informed decision on whether to choose a basket or accept the recommended one later.\"",\n  \""decision\"": \""reveal\"",\n  \""parameters\"": [\""1 a\"", \""1 b\"", \""1 c\""]\n}"", ""revealed 1 A"", ""revealed 1 B"", ""revealed 1 C"", ""{\n  \""explanation\"": \""after revealing boxes in basket 1, we found 2 prizes of type a (worth 9 points each), 4 prizes of type b (worth 19 points each), and 2 prizes of type c (worth 2 points each). the total points from these revealed prizes are: (2 * 9) + (4 * 19) + (2 * 2) = 18 + 76 + 4 = 98 points. however, we also need to account for the cost of revealing 3 boxes, which is 6 points (2 points per box). therefore, the net points from basket 1 are 98 - 6 = 92 points. since we have not revealed any other baskets yet, i will choose basket 1 as it has provided a significant amount of points compared to the others.\"",\n  \""decision\"": \""choose\"",\n  \""parameters\"": [1]\n}"", ""chose basket 1""]","{""1,A"": 2, ""1,B"": 4, ""1,C"": 2}",1,6,92,0,gpt-4o-mini,
2025-02-10 17:03:41,test,3,5,"[""A"", ""B"", ""C"", ""D"", ""E""]","{""A"": 2, ""B"": 5, ""C"": 5, ""D"": 7, ""E"": 11}","{""1"": {""A"": 2, ""B"": 5, ""C"": 3, ""D"": 1, ""E"": 2}, ""2"": {""A"": 5, ""B"": 2, ""C"": 3, ""D"": 3, ""E"": 3}, ""3"": {""A"": 5, ""B"": 5, ""C"": 3, ""D"": 2, ""E"": 5}}",False,,3,"[""{\""explanation\"":\""in the current game state, all baskets have the same number of prizes for each type, which means that the recommended basket will be the one with the highest total point value. since the total points of all prizes in each basket add up to 30, i need to consider the point values of the prizes. the recommended basket will be the one with the highest total value based on the prize distribution. however, since i have no information about the actual distribution of prizes in each basket, revealing some boxes would provide valuable information to make a more informed decision. i will choose to reveal some boxes to gather more information about the hidden prizes.\"",\""decision\"":\""reveal\"",\""parameters\"":[\""1 a\"",\""1 b\"",\""1 c\""]}"", ""revealed 1 A"", ""revealed 1 B"", ""revealed 1 C"", ""{\""explanation\"":\""after revealing the boxes in basket 1, i found 2 prizes of type a, 5 prizes of type b, and 3 prizes of type c. i still need to gather information about the remaining prize types (d and e) in basket 1, as they could significantly affect the total point value. since i have already revealed some boxes in basket 1, i will continue to reveal more boxes in the same basket to maximize my understanding of its contents before making a decision on whether to choose or accept it.\"",\""decision\"":\""reveal\"",\""parameters\"":[\""1 d\"",\""1 e\""]}"", ""revealed 1 D"", ""revealed 1 E"", ""{\""explanation\"":\""after revealing all the boxes in basket 1, i found the following distribution: 2 prizes of type a (2 points each), 5 prizes of type b (5 points each), 3 prizes of type c (5 points each), 1 prize of type d (7 points), and 2 prizes of type e (11 points each). calculating the total points from these prizes gives me: (2*2) + (5*5) + (3*5) + (1*7) + (2*11) = 4 + 25 + 15 + 7 + 22 = 73 points. since i have complete information about basket 1 and no information about baskets 2 and 3, i will choose basket 1 as it has the highest known value.\"",\""decision\"":\""choose\"",\""parameters\"":[1]}"", ""chose basket 1""]","{""1,A"": 2, ""1,B"": 5, ""1,C"": 3, ""1,D"": 1, ""1,E"": 2}",1,10,63,0,gpt-4o-mini,
2025-02-10 17:04:01,test,3,5,"[""A"", ""B"", ""C"", ""D"", ""E""]","{""A"": 6, ""B"": 6, ""C"": 6, ""D"": 7, ""E"": 5}","{""1"": {""A"": 3, ""B"": 4, ""C"": 3, ""D"": 2, ""E"": 5}, ""2"": {""A"": 1, ""B"": 1, ""C"": 5, ""D"": 5, ""E"": 2}, ""3"": {""A"": 5, ""B"": 2, ""C"": 1, ""D"": 2, ""E"": 5}}",False,,1,"[""{\n  \""explanation\"": \""since all baskets currently have no revealed prizes, i cannot determine which basket is optimal based on the prize distribution. however, i can see that the recommended basket is the one with the highest total count of prizes, which is currently equal across all baskets. therefore, i will choose to reveal some boxes to gather more information about the hidden prizes. i will reveal one box from each basket to start understanding the prize distribution.\"",\n  \""decision\"": \""reveal\"",\n  \""parameters\"": [\""1 a\"", \""2 a\"", \""3 a\""]\n}"", ""revealed 1 A"", ""revealed 2 A"", ""revealed 3 A"", ""{\n  \""explanation\"": \""i have revealed one prize of type a from each basket. basket 1 has 3 a prizes, basket 2 has 1 a prize, and basket 3 has 5 a prizes. since basket 3 has the highest number of revealed a prizes, it is likely to have a higher overall payout. i will now choose basket 3 as it seems to be the most promising based on the revealed information.\"",\n  \""decision\"": \""choose\"",\n  \""parameters\"": [3]\n}"", ""chose basket 3""]","{""1,A"": 3, ""2,A"": 1, ""3,A"": 5}",3,6,81,0,gpt-4o-mini,
2025-02-10 17:04:06,test,6,3,"[""A"", ""B"", ""C""]","{""A"": 2, ""B"": 21, ""C"": 7}","{""1"": {""A"": 2, ""B"": 5, ""C"": 5}, ""2"": {""A"": 1, ""B"": 3, ""C"": 1}, ""3"": {""A"": 3, ""B"": 1, ""C"": 4}, ""4"": {""A"": 1, ""B"": 2, ""C"": 4}, ""5"": {""A"": 5, ""B"": 2, ""C"": 5}, ""6"": {""A"": 3, ""B"": 2, ""C"": 2}}",True,1,1,"[""{\n  \""explanation\"": \""the recommended basket is basket 1, which is optimal to choose since it is the only basket available at this stage. all other baskets have hidden prizes, and without revealing any boxes, i cannot determine if they would yield a higher payout. therefore, i will accept the recommended basket as it is the best option given the current information.\"",\n  \""decision\"": \""accept\"",\n  \""parameters\"": []\n}"", ""accepted default basket 1""]",{},1,0,144,0,gpt-4o-mini,
2025-02-10 17:04:08,test,5,3,"[""A"", ""B"", ""C""]","{""A"": 27, ""B"": 3, ""C"": 0}","{""1"": {""A"": 5, ""B"": 2, ""C"": 4}, ""2"": {""A"": 4, ""B"": 4, ""C"": 1}, ""3"": {""A"": 3, ""B"": 3, ""C"": 1}, ""4"": {""A"": 4, ""B"": 5, ""C"": 5}, ""5"": {""A"": 2, ""B"": 3, ""C"": 1}}",False,,1,"[""{\n  \""explanation\"": \""currently, all baskets have no revealed prizes, and we know the point values of the prizes. since basket 1 has the highest point value for prize a (27 points), it is likely to yield the highest payout if we can find any prizes in it. however, since we have no information about the distribution of prizes in any of the baskets, i will choose to reveal some boxes in basket 1 to gather more information. this will help us determine if the high point value of prize a is actually present in this basket.\"",\n  \""decision\"": \""reveal\"",\n  \""parameters\"": [\""1 a\"", \""1 b\"", \""1 c\""]\n}"", ""revealed 1 A"", ""revealed 1 B"", ""revealed 1 C"", ""{\n  \""explanation\"": \""after revealing prizes in basket 1, we found 5 a prizes, 2 b prizes, and 4 c prizes. the total points from these prizes are calculated as follows: (5 * 27) + (2 * 3) + (4 * 0) = 135 + 6 + 0 = 141 points. however, we need to subtract the cost of revealing the boxes. since we revealed 3 boxes, the cost is 3 * 2 = 6 points. therefore, the net payout for basket 1 is 141 - 6 = 135 points. since we have not revealed any other baskets yet, i will choose basket 1 as it has the highest net payout based on the revealed information.\"",\n  \""decision\"": \""choose\"",\n  \""parameters\"": [1]\n}"", ""chose basket 1""]","{""1,A"": 5, ""1,B"": 2, ""1,C"": 4}",1,6,135,0,gpt-4o-mini,
2025-02-10 17:04:15,test,3,4,"[""A"", ""B"", ""C"", ""D""]","{""A"": 2, ""B"": 22, ""C"": 1, ""D"": 5}","{""1"": {""A"": 1, ""B"": 3, ""C"": 4, ""D"": 3}, ""2"": {""A"": 3, ""B"": 2, ""C"": 4, ""D"": 5}, ""3"": {""A"": 1, ""B"": 2, ""C"": 3, ""D"": 5}}",False,,1,"[""{\n  \""explanation\"": \""in this game state, we have three baskets, but we don't know the distribution of prizes in each. however, we can calculate the potential points for each basket based on the prize values and the average counts. the total potential points for each basket can be estimated as follows: basket 1 has 2 a's (4 points), 1 b (22 points), 0 c's (0 points), and 5 d's (25 points), giving a total of 51 points. basket 2 and basket 3 have similar distributions but we need to reveal boxes to confirm their contents. since we have no information yet, i will choose to reveal some boxes to gather more information about the hidden prizes in the baskets. this will help us make a more informed decision later on.\"",\n  \""decision\"": \""reveal\"",\n  \""parameters\"": [\""1 a\"", \""1 b\"", \""1 c\""]\n}"", ""revealed 1 A"", ""revealed 1 B"", ""revealed 1 C"", ""{\n  \""explanation\"": \""after revealing the boxes in basket 1, we found 1 a, 3 b, and 4 c. this gives us a clearer picture of the prize distribution in basket 1. the total points from these revealed prizes are: 1 a (2 points), 3 b (66 points), and 4 c (4 points), totaling 72 points. however, we still need to consider the cost of revealing boxes. since we revealed 3 boxes, we incur a cost of 6 points, bringing the effective total down to 66 points. we have not yet revealed any prizes from basket 2 or basket 3, so i will choose to reveal more boxes in basket 2 to gather additional information and compare potential payouts.\"",\n  \""decision\"": \""reveal\"",\n  \""parameters\"": [\""2 a\"", \""2 b\"", \""2 c\""]\n}"", ""revealed 2 A"", ""revealed 2 B"", ""revealed 2 C"", ""{\n  \""explanation\"": \""after revealing the boxes in basket 2, we found 3 a's, 2 b's, and 4 c's. the total points from these revealed prizes are: 3 a (6 points), 2 b (44 points), and 4 c (4 points), totaling 54 points. considering the cost of revealing 3 boxes, which is 6 points, the effective total for basket 2 is 48 points. now, comparing the effective totals: basket 1 has 66 points and basket 2 has 48 points. since basket 1 has a higher effective total, i will choose to take basket 1 as it appears to be the most rewarding option based on the revealed information.\"",\n  \""decision\"": \""choose\"",\n  \""parameters\"": [1]\n}"", ""chose basket 1""]","{""1,A"": 1, ""1,B"": 3, ""1,C"": 4, ""2,A"": 3, ""2,B"": 2, ""2,C"": 4}",1,12,75,0,gpt-4o-mini,
2025-02-10 17:04:26,test,6,6,"[""A"", ""B"", ""C"", ""D"", ""E"", ""F""]","{""A"": 5, ""B"": 7, ""C"": 1, ""D"": 2, ""E"": 7, ""F"": 8}","{""1"": {""A"": 1, ""B"": 4, ""C"": 5, ""D"": 4, ""E"": 2, ""F"": 4}, ""2"": {""A"": 5, ""B"": 3, ""C"": 2, ""D"": 3, ""E"": 2, ""F"": 4}, ""3"": {""A"": 1, ""B"": 5, ""C"": 2, ""D"": 1, ""E"": 2, ""F"": 4}, ""4"": {""A"": 2, ""B"": 1, ""C"": 4, ""D"": 2, ""E"": 3, ""F"": 2}, ""5"": {""A"": 2, ""B"": 1, ""C"": 3, ""D"": 2, ""E"": 2, ""F"": 2}, ""6"": {""A"": 2, ""B"": 1, ""C"": 4, ""D"": 4, ""E"": 4, ""F"": 3}}",True,1,2,"[""{\n  \""explanation\"": \""the recommended basket is basket 1, and since there are no revealed prizes yet, it is optimal to accept this recommendation. accepting the recommended basket allows me to proceed without incurring any costs from revealing boxes, and it is based on the assumption that it has the highest potential payout based on total prize counts.\"",\n  \""decision\"": \""accept\"",\n  \""parameters\"": []\n}"", ""accepted default basket 1""]",{},1,0,92,0,gpt-4o-mini,
2025-02-10 17:04:28,test,6,3,"[""A"", ""B"", ""C""]","{""A"": 14, ""B"": 8, ""C"": 8}","{""1"": {""A"": 4, ""B"": 3, ""C"": 3}, ""2"": {""A"": 3, ""B"": 1, ""C"": 1}, ""3"": {""A"": 2, ""B"": 4, ""C"": 5}, ""4"": {""A"": 5, ""B"": 1, ""C"": 5}, ""5"": {""A"": 2, ""B"": 5, ""C"": 3}, ""6"": {""A"": 4, ""B"": 2, ""C"": 4}}",False,,,"[""{\n  \""explanation\"": \""since all baskets currently have hidden prizes and no information has been revealed yet, i cannot determine which basket is optimal based on the prize distribution. however, i can see that the recommended basket is the one with the highest total count of prizes, which is basket 1, as it has the highest point value for the prizes. therefore, i will accept the recommended basket.\"",\n  \""decision\"": \""accept\"",\n  \""parameters\"": []\n}""]",{},,0,,0,gpt-4o-mini,Unknown command
2025-02-10 17:04:31,test,6,3,"[""A"", ""B"", ""C""]","{""A"": 5, ""B"": 15, ""C"": 10}","{""1"": {""A"": 4, ""B"": 2, ""C"": 5}, ""2"": {""A"": 1, ""B"": 1, ""C"": 3}, ""3"": {""A"": 2, ""B"": 3, ""C"": 1}, ""4"": {""A"": 2, ""B"": 2, ""C"": 1}, ""5"": {""A"": 1, ""B"": 5, ""C"": 4}, ""6"": {""A"": 5, ""B"": 1, ""C"": 4}}",False,,5,"[""{\n  \""explanation\"": \""since all baskets currently have hidden prizes and no information has been revealed, i need to gather more data to make an informed decision. revealing some boxes will help me understand the distribution of prizes across the baskets. i will reveal one box from each basket to get a clearer picture of the prize distribution.\"",\n  \""decision\"": \""reveal\"",\n  \""parameters\"": [\""1 a\"", \""2 a\"", \""3 a\"", \""4 a\"", \""5 a\"", \""6 a\""]\n}"", ""revealed 1 A"", ""revealed 2 A"", ""revealed 3 A"", ""revealed 4 A"", ""revealed 5 A"", ""revealed 6 A"", ""{\n  \""explanation\"": \""i have revealed the number of a prizes in each basket. now i need to gather information about the b and c prizes, which are still hidden. since i have already revealed the a prizes, i will now reveal one box from each basket to check for b prizes, as they have the highest point value.\"",\n  \""decision\"": \""reveal\"",\n  \""parameters\"": [\""1 b\"", \""2 b\"", \""3 b\"", \""4 b\"", \""5 b\"", \""6 b\""]\n}"", ""revealed 1 B"", ""revealed 2 B"", ""revealed 3 B"", ""revealed 4 B"", ""revealed 5 B"", ""revealed 6 B"", ""{\n  \""explanation\"": \""i have now revealed the number of a and b prizes in each basket. the next step is to reveal the c prizes, as they are still hidden and could significantly impact the total score. since all baskets have the same potential for c prizes, i will reveal one box from each basket to gather this final piece of information.\"",\n  \""decision\"": \""reveal\"",\n  \""parameters\"": [\""1 c\"", \""2 c\"", \""3 c\"", \""4 c\"", \""5 c\"", \""6 c\""]\n}"", ""revealed 1 C"", ""revealed 2 C"", ""revealed 3 C"", ""revealed 4 C"", ""revealed 5 C"", ""revealed 6 C"", ""{\n  \""explanation\"": \""i have now revealed all the prizes in each basket. i can calculate the total points for each basket based on the revealed prizes. the total points for each basket are as follows: \\n- basket 1: (4 * 5) + (2 * 15) + (5 * 10) = 20 + 30 + 50 = 100 points \\n- basket 2: (1 * 5) + (1 * 15) + (3 * 10) = 5 + 15 + 30 = 50 points \\n- basket 3: (2 * 5) + (3 * 15) + (1 * 10) = 10 + 45 + 10 = 65 points \\n- basket 4: (2 * 5) + (2 * 15) + (1 * 10) = 10 + 30 + 10 = 50 points \\n- basket 5: (1 * 5) + (5 * 15) + (4 * 10) = 5 + 75 + 40 = 120 points \\n- basket 6: (5 * 5) + (1 * 15) + (4 * 10) = 25 + 15 + 40 = 80 points \\n\\nbased on these calculations, basket 5 has the highest total points. therefore, i will choose basket 5.\"",\n  \""decision\"": \""choose\"",\n  \""parameters\"": [5]\n}"", ""chose basket 5""]","{""1,A"": 4, ""2,A"": 1, ""3,A"": 2, ""4,A"": 2, ""5,A"": 1, ""6,A"": 5, ""1,B"": 2, ""2,B"": 1, ""3,B"": 3, ""4,B"": 2, ""5,B"": 5, ""6,B"": 1, ""1,C"": 5, ""2,C"": 3, ""3,C"": 1, ""4,C"": 1, ""5,C"": 4, ""6,C"": 4}",5,36,84,0,gpt-4o-mini,
2025-02-10 17:04:49,test,6,5,"[""A"", ""B"", ""C"", ""D"", ""E""]","{""A"": 5, ""B"": 3, ""C"": 7, ""D"": 12, ""E"": 3}","{""1"": {""A"": 5, ""B"": 3, ""C"": 1, ""D"": 4, ""E"": 1}, ""2"": {""A"": 2, ""B"": 1, ""C"": 1, ""D"": 4, ""E"": 5}, ""3"": {""A"": 3, ""B"": 1, ""C"": 3, ""D"": 4, ""E"": 1}, ""4"": {""A"": 3, ""B"": 4, ""C"": 2, ""D"": 5, ""E"": 5}, ""5"": {""A"": 4, ""B"": 4, ""C"": 5, ""D"": 2, ""E"": 3}, ""6"": {""A"": 4, ""B"": 1, ""C"": 3, ""D"": 3, ""E"": 3}}",False,,4,"[""{\n  \""explanation\"": \""since all baskets have hidden prizes and no information has been revealed yet, i will choose to reveal some boxes to gather more information about the prizes. this will help me make a more informed decision about which basket to choose later. i will reveal one box from each basket to get a sense of the distribution of prizes.\"",\n  \""decision\"": \""reveal\"",\n  \""parameters\"": [\""1 a\"", \""2 a\"", \""3 a\"", \""4 a\"", \""5 a\"", \""6 a\""]\n}"", ""revealed 1 A"", ""revealed 2 A"", ""revealed 3 A"", ""revealed 4 A"", ""revealed 5 A"", ""revealed 6 A"", ""{\n  \""explanation\"": \""after revealing the number of a prizes in each basket, i can see that basket 1 has the highest count of a prizes (5), followed by basket 5 (4) and basket 6 (4). however, i still need to gather more information about the other prize types (b, c, d, e) to make a fully informed decision. i will now reveal one box from each basket for prize type b to see if there are any significant counts there.\"",\n  \""decision\"": \""reveal\"",\n  \""parameters\"": [\""1 b\"", \""2 b\"", \""3 b\"", \""4 b\"", \""5 b\"", \""6 b\""]\n}"", ""revealed 1 B"", ""revealed 2 B"", ""revealed 3 B"", ""revealed 4 B"", ""revealed 5 B"", ""revealed 6 B"", ""{\n  \""explanation\"": \""after revealing the counts for both prize type a and prize type b, i can see that basket 1 has a total of 5 a prizes and 3 b prizes, giving it a strong potential payout. basket 4 also has a notable count with 3 a prizes and 4 b prizes. however, basket 1 has the highest total count of prizes revealed so far. i will now calculate the potential payouts for each basket based on the revealed information and choose the basket that seems to provide the best overall value.\"",\n  \""decision\"": \""choose\"",\n  \""parameters\"": [1]\n}"", ""chose basket 1""]","{""1,A"": 5, ""2,A"": 2, ""3,A"": 3, ""4,A"": 3, ""5,A"": 4, ""6,A"": 4, ""1,B"": 3, ""2,B"": 1, ""3,B"": 1, ""4,B"": 4, ""5,B"": 4, ""6,B"": 1}",1,24,68,0,gpt-4o-mini,
2025-02-10 17:04:56,test,5,5,"[""A"", ""B"", ""C"", ""D"", ""E""]","{""A"": 5, ""B"": 7, ""C"": 9, ""D"": 4, ""E"": 5}","{""1"": {""A"": 2, ""B"": 1, ""C"": 2, ""D"": 5, ""E"": 5}, ""2"": {""A"": 3, ""B"": 5, ""C"": 2, ""D"": 4, ""E"": 3}, ""3"": {""A"": 1, ""B"": 1, ""C"": 1, ""D"": 1, ""E"": 4}, ""4"": {""A"": 1, ""B"": 1, ""C"": 2, ""D"": 2, ""E"": 5}, ""5"": {""A"": 2, ""B"": 4, ""C"": 5, ""D"": 5, ""E"": 4}}",True,5,5,"[""{\""explanation\"":\""the recommended basket is basket 5, which is suggested based on the highest total count of prizes. since i have no information about the actual distribution of prizes in any of the baskets, accepting the recommended basket seems to be the best option at this point. it allows me to proceed without incurring any costs from revealing boxes, and i can potentially maximize my points based on the recommendation.\"",\""decision\"":\""accept\"",\""parameters\"":[]}"", ""accepted default basket 5""]",{},5,0,123,0,gpt-4o-mini,
2025-02-10 17:04:58,test,4,5,"[""A"", ""B"", ""C"", ""D"", ""E""]","{""A"": 5, ""B"": 7, ""C"": 2, ""D"": 6, ""E"": 10}","{""1"": {""A"": 1, ""B"": 1, ""C"": 2, ""D"": 2, ""E"": 4}, ""2"": {""A"": 3, ""B"": 4, ""C"": 4, ""D"": 3, ""E"": 4}, ""3"": {""A"": 3, ""B"": 2, ""C"": 5, ""D"": 4, ""E"": 5}, ""4"": {""A"": 2, ""B"": 5, ""C"": 5, ""D"": 1, ""E"": 4}}",True,3,3,"[""{\""explanation\"":\""the recommended basket is basket 3, which is suggested based on the highest potential payout when considering the total count of prizes. since i have no information about the actual prizes in any of the baskets, accepting the recommended basket seems to be the best option at this point. it allows me to proceed without incurring any costs from revealing boxes and maximizes my chances based on the available data.\"",\""decision\"":\""accept\"",\""parameters\"":[]}"", ""accepted default basket 3""]",{},3,0,113,0,gpt-4o-mini,
2025-02-10 17:05:00,test,7,5,"[""A"", ""B"", ""C"", ""D"", ""E""]","{""A"": 0, ""B"": 2, ""C"": 4, ""D"": 22, ""E"": 2}","{""1"": {""A"": 4, ""B"": 2, ""C"": 5, ""D"": 1, ""E"": 2}, ""2"": {""A"": 4, ""B"": 4, ""C"": 2, ""D"": 3, ""E"": 2}, ""3"": {""A"": 3, ""B"": 1, ""C"": 2, ""D"": 1, ""E"": 4}, ""4"": {""A"": 4, ""B"": 4, ""C"": 5, ""D"": 1, ""E"": 2}, ""5"": {""A"": 1, ""B"": 3, ""C"": 1, ""D"": 1, ""E"": 1}, ""6"": {""A"": 4, ""B"": 4, ""C"": 4, ""D"": 2, ""E"": 1}, ""7"": {""A"": 5, ""B"": 4, ""C"": 2, ""D"": 3, ""E"": 1}}",True,4,2,"[""{\n  \""explanation\"": \""the recommended basket is basket 4, which is likely the highest-paying option based on the total count of prizes. since i have not revealed any boxes yet and there are no penalties for choosing the recommended basket, i will accept it. this allows me to maximize my potential payout without incurring any costs from revealing boxes.\"",\n  \""decision\"": \""accept\"",\n  \""parameters\"": []\n}"", ""accepted default basket 4""]",{},4,0,54,0,gpt-4o-mini,
