timestamp,round_type,num_baskets,num_prize_types,prize_labels,prize_values,basket_counts,nudge_present,default_basket,best_basket,action_log,revealed_cells,final_choice,total_reveal_cost,points_earned,wrong_moves,model_used,error
2025-02-10 17:08:28,test,6,3,"[""A"", ""B"", ""C""]","{""A"": 14, ""B"": 8, ""C"": 8}","{""1"": {""A"": 4, ""B"": 3, ""C"": 3}, ""2"": {""A"": 3, ""B"": 1, ""C"": 1}, ""3"": {""A"": 2, ""B"": 4, ""C"": 5}, ""4"": {""A"": 5, ""B"": 1, ""C"": 5}, ""5"": {""A"": 2, ""B"": 5, ""C"": 3}, ""6"": {""A"": 4, ""B"": 2, ""C"": 4}}",False,,4,"[""```json\n{\n  \""explanation\"": \""given that there are three types of prizes with varying point values, i need to gather more information about the distribution of these prizes across the baskets. since revealing each cell costs 2 points, i will start by revealing one cell from each basket to get an initial sense of the prize distribution. this will help in estimating which basket might have the highest payout potential.\"",\n  \""decision\"": \""reveal\"",\n  \""parameters\"": [\""1 a\"", \""2 a\"", \""3 a\"", \""4 a\"", \""5 a\"", \""6 a\""]\n}\n```"", ""revealed 1 A"", ""revealed 2 A"", ""revealed 3 A"", ""revealed 4 A"", ""revealed 5 A"", ""revealed 6 A"", ""```json\n{\n  \""explanation\"": \""basket 4 currently has the highest number of a prizes, which are worth the most points. however, to make a more informed decision, i need to know the distribution of b and c prizes. i will reveal one b prize cell from each basket to gather more information about the potential payout.\"",\n  \""decision\"": \""reveal\"",\n  \""parameters\"": [\""1 b\"", \""2 b\"", \""3 b\"", \""4 b\"", \""5 b\"", \""6 b\""]\n}\n```"", ""revealed 1 B"", ""revealed 2 B"", ""revealed 3 B"", ""revealed 4 B"", ""revealed 5 B"", ""revealed 6 B"", ""```json\n{\n  \""explanation\"": \""basket 1 has a total of 7 prizes revealed so far, basket 2 has 4, basket 3 has 6, basket 4 has 6, basket 5 has 7, and basket 6 has 6. basket 5 has the highest number of b prizes, which are worth 8 points each. however, basket 1 also has a good number of a prizes, which are worth more points. to make a more informed decision, i will reveal one c prize cell from each basket to complete the information on prize distribution.\"",\n  \""decision\"": \""reveal\"",\n  \""parameters\"": [\""1 c\"", \""2 c\"", \""3 c\"", \""4 c\"", \""5 c\"", \""6 c\""]\n}\n```"", ""revealed 1 C"", ""revealed 2 C"", ""revealed 3 C"", ""revealed 4 C"", ""revealed 5 C"", ""revealed 6 C"", ""```json\n{\n  \""explanation\"": \""now that all prize types have been revealed, i can calculate the total potential payout for each basket. basket 1 has 4 a (56 points), 3 b (24 points), and 3 c (24 points) for a total of 104 points. basket 2 has 3 a (42 points), 1 b (8 points), and 1 c (8 points) for a total of 58 points. basket 3 has 2 a (28 points), 4 b (32 points), and 5 c (40 points) for a total of 100 points. basket 4 has 5 a (70 points), 1 b (8 points), and 5 c (40 points) for a total of 118 points. basket 5 has 2 a (28 points), 5 b (40 points), and 3 c (24 points) for a total of 92 points. basket 6 has 4 a (56 points), 2 b (16 points), and 4 c (32 points) for a total of 104 points. considering the cost of revealing cells, basket 4 has the highest potential payout. i will choose basket 4.\"",\n  \""decision\"": \""choose\"",\n  \""parameters\"": [4]\n}\n```"", ""chose basket 4""]","{""1,A"": 4, ""2,A"": 3, ""3,A"": 2, ""4,A"": 5, ""5,A"": 2, ""6,A"": 4, ""1,B"": 3, ""2,B"": 1, ""3,B"": 4, ""4,B"": 1, ""5,B"": 5, ""6,B"": 2, ""1,C"": 3, ""2,C"": 1, ""3,C"": 5, ""4,C"": 5, ""5,C"": 3, ""6,C"": 4}",4,36,82,0,gpt-4o,
2025-02-10 17:08:47,test,6,3,"[""A"", ""B"", ""C""]","{""A"": 5, ""B"": 15, ""C"": 10}","{""1"": {""A"": 4, ""B"": 2, ""C"": 5}, ""2"": {""A"": 1, ""B"": 1, ""C"": 3}, ""3"": {""A"": 2, ""B"": 3, ""C"": 1}, ""4"": {""A"": 2, ""B"": 2, ""C"": 1}, ""5"": {""A"": 1, ""B"": 5, ""C"": 4}, ""6"": {""A"": 5, ""B"": 1, ""C"": 4}}",False,,5,"[""```json\n{\n  \""explanation\"": \""given the current game state, we have three types of prizes with different point values. since we have no information about the number of prizes in each basket, it is beneficial to reveal some boxes to gather information. this will help us make a more informed decision about which basket to choose. i will start by revealing one box from each basket to get an initial sense of the distribution of prizes.\"",\n  \""decision\"": \""reveal\"",\n  \""parameters\"": [\""1 a\"", \""2 a\"", \""3 a\"", \""4 a\"", \""5 a\"", \""6 a\""]\n}\n```"", ""revealed 1 A"", ""revealed 2 A"", ""revealed 3 A"", ""revealed 4 A"", ""revealed 5 A"", ""revealed 6 A"", ""```json\n{\n  \""explanation\"": \""after revealing the number of a prizes in each basket, basket 6 has the highest number of a prizes, which are worth 5 points each. however, we still lack information about the b and c prizes, which have higher point values. to make a more informed decision, i will reveal one b prize from each basket to assess their distribution and potential impact on the total score.\"",\n  \""decision\"": \""reveal\"",\n  \""parameters\"": [\""1 b\"", \""2 b\"", \""3 b\"", \""4 b\"", \""5 b\"", \""6 b\""]\n}\n```"", ""revealed 1 B"", ""revealed 2 B"", ""revealed 3 B"", ""revealed 4 B"", ""revealed 5 B"", ""revealed 6 B"", ""```json\n{\n  \""explanation\"": \""after revealing the number of a and b prizes, basket 5 has the highest number of b prizes, which are worth 15 points each. however, we still lack information about the c prizes, which are worth 10 points each. revealing the c prizes will help us determine if there is a basket with a high number of c prizes that could potentially offer a higher total score. i will reveal one c prize from each basket to complete the information gathering.\"",\n  \""decision\"": \""reveal\"",\n  \""parameters\"": [\""1 c\"", \""2 c\"", \""3 c\"", \""4 c\"", \""5 c\"", \""6 c\""]\n}\n```"", ""revealed 1 C"", ""revealed 2 C"", ""revealed 3 C"", ""revealed 4 C"", ""revealed 5 C"", ""revealed 6 C"", ""```json\n{\n  \""explanation\"": \""now that we have complete information about the number of prizes in each basket, we can calculate the total score for each basket. basket 1 has 4 a (20 points), 2 b (30 points), and 5 c (50 points), totaling 100 points. basket 2 has 1 a (5 points), 1 b (15 points), and 3 c (30 points), totaling 50 points. basket 3 has 2 a (10 points), 3 b (45 points), and 1 c (10 points), totaling 65 points. basket 4 has 2 a (10 points), 2 b (30 points), and 1 c (10 points), totaling 50 points. basket 5 has 1 a (5 points), 5 b (75 points), and 4 c (40 points), totaling 120 points. basket 6 has 5 a (25 points), 1 b (15 points), and 4 c (40 points), totaling 80 points. considering the cost of revealing all boxes (12 points), basket 5 has the highest net score of 108 points. therefore, i will choose basket 5.\"",\n  \""decision\"": \""choose\"",\n  \""parameters\"": [5]\n}\n```"", ""chose basket 5""]","{""1,A"": 4, ""2,A"": 1, ""3,A"": 2, ""4,A"": 2, ""5,A"": 1, ""6,A"": 5, ""1,B"": 2, ""2,B"": 1, ""3,B"": 3, ""4,B"": 2, ""5,B"": 5, ""6,B"": 1, ""1,C"": 5, ""2,C"": 3, ""3,C"": 1, ""4,C"": 1, ""5,C"": 4, ""6,C"": 4}",5,36,84,0,gpt-4o,
2025-02-10 17:09:05,test,6,5,"[""A"", ""B"", ""C"", ""D"", ""E""]","{""A"": 5, ""B"": 3, ""C"": 7, ""D"": 12, ""E"": 3}","{""1"": {""A"": 5, ""B"": 3, ""C"": 1, ""D"": 4, ""E"": 1}, ""2"": {""A"": 2, ""B"": 1, ""C"": 1, ""D"": 4, ""E"": 5}, ""3"": {""A"": 3, ""B"": 1, ""C"": 3, ""D"": 4, ""E"": 1}, ""4"": {""A"": 3, ""B"": 4, ""C"": 2, ""D"": 5, ""E"": 5}, ""5"": {""A"": 4, ""B"": 4, ""C"": 5, ""D"": 2, ""E"": 3}, ""6"": {""A"": 4, ""B"": 1, ""C"": 3, ""D"": 3, ""E"": 3}}",False,,4,"[""```json\n{\n  \""explanation\"": \""given that there are five types of prizes with varying point values, it is important to gather more information about the distribution of these prizes across the baskets. since revealing each box costs 2 points, i will start by revealing one box from each basket to get an initial sense of the prize distribution without incurring too high a cost. this will help in making a more informed decision about which basket to choose.\"",\n  \""decision\"": \""reveal\"",\n  \""parameters\"": [\""1 a\"", \""2 a\"", \""3 a\"", \""4 a\"", \""5 a\"", \""6 a\""]\n}\n```"", ""revealed 1 A"", ""revealed 2 A"", ""revealed 3 A"", ""revealed 4 A"", ""revealed 5 A"", ""revealed 6 A"", ""```json\n{\n  \""explanation\"": \""after revealing the number of a prizes in each basket, basket 1 has the highest number of a prizes, which are worth 5 points each. however, to make a more informed decision, it is important to reveal another type of prize to understand the distribution better. i will reveal the b prizes in each basket, as they are the next lowest value prize, to see if any basket stands out with a high number of b prizes.\"",\n  \""decision\"": \""reveal\"",\n  \""parameters\"": [\""1 b\"", \""2 b\"", \""3 b\"", \""4 b\"", \""5 b\"", \""6 b\""]\n}\n```"", ""revealed 1 B"", ""revealed 2 B"", ""revealed 3 B"", ""revealed 4 B"", ""revealed 5 B"", ""revealed 6 B"", ""```json\n{\n  \""explanation\"": \""after revealing the a and b prizes, basket 1 has a total of 5 a and 3 b prizes, which gives it a total of 34 points from these two types alone. basket 4 also has a strong showing with 3 a and 4 b prizes, totaling 27 points. however, basket 1 still has the highest point total from the revealed prizes. to further refine the decision, i will reveal the c prizes, as they have a higher point value and could significantly impact the total score.\"",\n  \""decision\"": \""reveal\"",\n  \""parameters\"": [\""1 c\"", \""2 c\"", \""3 c\"", \""4 c\"", \""5 c\"", \""6 c\""]\n}\n```"", ""revealed 1 C"", ""revealed 2 C"", ""revealed 3 C"", ""revealed 4 C"", ""revealed 5 C"", ""revealed 6 C"", ""```json\n{\n  \""explanation\"": \""after revealing the a, b, and c prizes, basket 5 stands out with a total of 4 a, 4 b, and 5 c prizes, which gives it a total of 71 points from these three types alone (20 from a, 12 from b, and 35 from c). this is the highest point total among the baskets from the revealed prizes. given the high point value of the c prizes and the strong showing of basket 5, it is likely to be the optimal choice. therefore, i will choose basket 5.\"",\n  \""decision\"": \""choose\"",\n  \""parameters\"": [5]\n}\n```"", ""chose basket 5""]","{""1,A"": 5, ""2,A"": 2, ""3,A"": 3, ""4,A"": 3, ""5,A"": 4, ""6,A"": 4, ""1,B"": 3, ""2,B"": 1, ""3,B"": 1, ""4,B"": 4, ""5,B"": 4, ""6,B"": 1, ""1,C"": 1, ""2,C"": 1, ""3,C"": 3, ""4,C"": 2, ""5,C"": 5, ""6,C"": 3}",5,36,64,0,gpt-4o,
2025-02-10 17:09:20,test,5,5,"[""A"", ""B"", ""C"", ""D"", ""E""]","{""A"": 5, ""B"": 7, ""C"": 9, ""D"": 4, ""E"": 5}","{""1"": {""A"": 2, ""B"": 1, ""C"": 2, ""D"": 5, ""E"": 5}, ""2"": {""A"": 3, ""B"": 5, ""C"": 2, ""D"": 4, ""E"": 3}, ""3"": {""A"": 1, ""B"": 1, ""C"": 1, ""D"": 1, ""E"": 4}, ""4"": {""A"": 1, ""B"": 1, ""C"": 2, ""D"": 2, ""E"": 5}, ""5"": {""A"": 2, ""B"": 4, ""C"": 5, ""D"": 5, ""E"": 4}}",True,5,5,"[""```json\n{\n  \""explanation\"": \""since all baskets are currently unrevealed, we have no information about the distribution of prizes in each basket. however, we know that the recommended basket is based on the total count of prizes, which suggests that basket 5 has the highest total number of prizes. given that the total points of all prizes always add up to 30, the distribution of prize types does not affect the total point value as much as the total number of prizes does. therefore, accepting the recommended basket is a reasonable choice at this stage.\"",\n  \""decision\"": \""accept\"",\n  \""parameters\"": []\n}\n```"", ""accepted default basket 5""]",{},5,0,123,0,gpt-4o,
2025-02-10 17:09:23,test,4,5,"[""A"", ""B"", ""C"", ""D"", ""E""]","{""A"": 5, ""B"": 7, ""C"": 2, ""D"": 6, ""E"": 10}","{""1"": {""A"": 1, ""B"": 1, ""C"": 2, ""D"": 2, ""E"": 4}, ""2"": {""A"": 3, ""B"": 4, ""C"": 4, ""D"": 3, ""E"": 4}, ""3"": {""A"": 3, ""B"": 2, ""C"": 5, ""D"": 4, ""E"": 5}, ""4"": {""A"": 2, ""B"": 5, ""C"": 5, ""D"": 1, ""E"": 4}}",True,3,3,"[""```json\n{\n  \""explanation\"": \""the recommended basket is basket 3, which is suggested based on the total count of prizes, assuming all prizes are equal. however, the actual point value of each prize type varies, and without revealing any boxes, we cannot be certain that basket 3 is the optimal choice in terms of point value. since there are no wrong moves yet, it is prudent to reveal some boxes to gather more information about the distribution of higher-value prizes, particularly those with higher point values like e (10 points) and b (7 points). this will help in making a more informed decision.\"",\n  \""decision\"": \""reveal\"",\n  \""parameters\"": [\""3 a\"", \""3 b\"", \""3 e\""]\n}\n```"", ""revealed 3 A"", ""revealed 3 B"", ""revealed 3 E"", ""```json\n{\n  \""explanation\"": \""basket 3 has been partially revealed, showing 3 prizes of type a (5 points each), 2 prizes of type b (7 points each), and 5 prizes of type e (10 points each). this gives a total of (3*5) + (2*7) + (5*10) = 15 + 14 + 50 = 79 points. the cost of revealing these three cells is 6 points, resulting in a net score of 73 points for basket 3. given the high value of the revealed prizes, particularly the 5 prizes of type e, basket 3 is likely to be a strong choice. therefore, it is reasonable to accept the recommended basket 3.\"",\n  \""decision\"": \""accept\"",\n  \""parameters\"": []\n}\n```"", ""accepted default basket 3""]","{""3,A"": 3, ""3,B"": 2, ""3,E"": 5}",3,6,107,0,gpt-4o,
2025-02-10 17:09:34,test,7,5,"[""A"", ""B"", ""C"", ""D"", ""E""]","{""A"": 0, ""B"": 2, ""C"": 4, ""D"": 22, ""E"": 2}","{""1"": {""A"": 4, ""B"": 2, ""C"": 5, ""D"": 1, ""E"": 2}, ""2"": {""A"": 4, ""B"": 4, ""C"": 2, ""D"": 3, ""E"": 2}, ""3"": {""A"": 3, ""B"": 1, ""C"": 2, ""D"": 1, ""E"": 4}, ""4"": {""A"": 4, ""B"": 4, ""C"": 5, ""D"": 1, ""E"": 2}, ""5"": {""A"": 1, ""B"": 3, ""C"": 1, ""D"": 1, ""E"": 1}, ""6"": {""A"": 4, ""B"": 4, ""C"": 4, ""D"": 2, ""E"": 1}, ""7"": {""A"": 5, ""B"": 4, ""C"": 2, ""D"": 3, ""E"": 1}}",True,4,2,"[""```json\n{\n  \""explanation\"": \""given the current game state, the recommended basket is basket 4. since the recommendation is based on the total count of prizes, and we have no information about the distribution of high-value prizes like d (22 points), it might be beneficial to gather more information before making a decision. revealing a few boxes could provide insight into the presence of high-value prizes, which could significantly impact the basket's payout. therefore, i will reveal one box from each basket to get a sense of the prize distribution.\"",\n  \""decision\"": \""reveal\"",\n  \""parameters\"": [\""1 a\"", \""2 a\"", \""3 a\"", \""4 a\"", \""5 a\"", \""6 a\"", \""7 a\""]\n}\n```"", ""revealed 1 A"", ""revealed 2 A"", ""revealed 3 A"", ""revealed 4 A"", ""revealed 5 A"", ""revealed 6 A"", ""revealed 7 A"", ""```json\n{\n  \""explanation\"": \""the initial reveal provided information about the number of a prizes, which are worth 0 points and do not contribute to the basket's payout. to make a more informed decision, it is crucial to reveal information about the high-value prize d (22 points) as it can significantly impact the basket's total value. i will reveal one box from each basket for prize d to assess the distribution of this high-value prize.\"",\n  \""decision\"": \""reveal\"",\n  \""parameters\"": [\""1 d\"", \""2 d\"", \""3 d\"", \""4 d\"", \""5 d\"", \""6 d\"", \""7 d\""]\n}\n```"", ""revealed 1 D"", ""revealed 2 D"", ""revealed 3 D"", ""revealed 4 D"", ""revealed 5 D"", ""revealed 6 D"", ""revealed 7 D"", ""```json\n{\n  \""explanation\"": \""after revealing the number of high-value d prizes, basket 2 and basket 7 have the highest counts of d prizes, which significantly contribute to the basket's total value. basket 2 has 3 d prizes, and basket 7 also has 3 d prizes. given the high value of d prizes, these baskets are likely to have a higher payout. basket 4, the recommended basket, only has 1 d prize, making it less appealing compared to baskets 2 and 7. since basket 2 and basket 7 have the same number of d prizes, i will choose basket 2 as it was revealed first.\"",\n  \""decision\"": \""choose\"",\n  \""parameters\"": [2]\n}\n```"", ""chose basket 2""]","{""1,A"": 4, ""2,A"": 4, ""3,A"": 3, ""4,A"": 4, ""5,A"": 1, ""6,A"": 4, ""7,A"": 5, ""1,D"": 1, ""2,D"": 3, ""3,D"": 1, ""4,D"": 1, ""5,D"": 1, ""6,D"": 2, ""7,D"": 3}",2,28,58,0,gpt-4o,
2025-02-10 17:09:48,test,5,4,"[""A"", ""B"", ""C"", ""D""]","{""A"": 0, ""B"": 9, ""C"": 4, ""D"": 17}","{""1"": {""A"": 3, ""B"": 1, ""C"": 1, ""D"": 2}, ""2"": {""A"": 1, ""B"": 2, ""C"": 4, ""D"": 4}, ""3"": {""A"": 1, ""B"": 1, ""C"": 3, ""D"": 2}, ""4"": {""A"": 4, ""B"": 5, ""C"": 2, ""D"": 4}, ""5"": {""A"": 5, ""B"": 1, ""C"": 4, ""D"": 1}}",False,,4,"[""```json\n{\n  \""explanation\"": \""given the current game state, we have four types of prizes with varying point values: a (0 points), b (9 points), c (4 points), and d (17 points). the total points for all prizes add up to 30, which aligns with the game's rules. since no boxes have been revealed yet, we lack specific information about the distribution of prizes in each basket. revealing a few boxes could provide insights into the potential payout of each basket, especially since the point values for b and d are relatively high. this information will help in making a more informed decision. therefore, i will reveal one box from each basket to gather initial data.\"",\n  \""decision\"": \""reveal\"",\n  \""parameters\"": [\""1 a\"", \""2 a\"", \""3 a\"", \""4 a\"", \""5 a\""]\n}\n```"", ""revealed 1 A"", ""revealed 2 A"", ""revealed 3 A"", ""revealed 4 A"", ""revealed 5 A"", ""```json\n{\n  \""explanation\"": \""we have revealed the number of a prizes in each basket, which are worth 0 points. this information does not contribute to the potential payout of the baskets. to make a more informed decision, it is important to reveal the number of prizes for types b and d, as they have higher point values (9 and 17 points respectively). revealing these will help us estimate the potential payout of each basket more accurately. i will reveal one b prize from each basket to gather more information.\"",\n  \""decision\"": \""reveal\"",\n  \""parameters\"": [\""1 b\"", \""2 b\"", \""3 b\"", \""4 b\"", \""5 b\""]\n}\n```"", ""revealed 1 B"", ""revealed 2 B"", ""revealed 3 B"", ""revealed 4 B"", ""revealed 5 B"", ""```json\n{\n  \""explanation\"": \""we have now revealed the number of b prizes in each basket, which are worth 9 points each. basket 4 has the highest number of b prizes (5), which gives it a significant potential payout from b prizes alone. however, we still need to consider the d prizes, which are worth 17 points each and could greatly influence the total payout. revealing the d prizes will provide crucial information to make a more informed decision. i will reveal one d prize from each basket to gather this information.\"",\n  \""decision\"": \""reveal\"",\n  \""parameters\"": [\""1 d\"", \""2 d\"", \""3 d\"", \""4 d\"", \""5 d\""]\n}\n```"", ""revealed 1 D"", ""revealed 2 D"", ""revealed 3 D"", ""revealed 4 D"", ""revealed 5 D"", ""```json\n{\n  \""explanation\"": \""we have now revealed the number of d prizes in each basket, which are worth 17 points each. basket 2 and basket 4 both have 4 d prizes, which gives them a significant potential payout from d prizes alone. basket 4 also has the highest number of b prizes (5), which further increases its potential payout. basket 4 seems to have the highest potential payout based on the revealed b and d prizes. therefore, i will choose basket 4.\"",\n  \""decision\"": \""choose\"",\n  \""parameters\"": [4]\n}\n```"", ""chose basket 4""]","{""1,A"": 3, ""2,A"": 1, ""3,A"": 1, ""4,A"": 4, ""5,A"": 5, ""1,B"": 1, ""2,B"": 2, ""3,B"": 1, ""4,B"": 5, ""5,B"": 1, ""1,D"": 2, ""2,D"": 4, ""3,D"": 2, ""4,D"": 4, ""5,D"": 1}",4,30,91,0,gpt-4o,
2025-02-10 17:10:04,test,5,6,"[""A"", ""B"", ""C"", ""D"", ""E"", ""F""]","{""A"": 5, ""B"": 4, ""C"": 2, ""D"": 4, ""E"": 5, ""F"": 10}","{""1"": {""A"": 3, ""B"": 3, ""C"": 2, ""D"": 1, ""E"": 1, ""F"": 3}, ""2"": {""A"": 5, ""B"": 1, ""C"": 5, ""D"": 3, ""E"": 5, ""F"": 1}, ""3"": {""A"": 4, ""B"": 5, ""C"": 3, ""D"": 2, ""E"": 5, ""F"": 2}, ""4"": {""A"": 2, ""B"": 1, ""C"": 3, ""D"": 1, ""E"": 2, ""F"": 5}, ""5"": {""A"": 1, ""B"": 3, ""C"": 1, ""D"": 4, ""E"": 5, ""F"": 3}}",True,3,3,"[""```json\n{\n  \""explanation\"": \""the recommended basket is basket 3, which is suggested based on the total count of prizes without considering their point values. since i have no information about the distribution of prize types in any basket, and revealing boxes incurs a cost, accepting the recommended basket is a reasonable choice. this minimizes the risk of incurring unnecessary costs from revealing boxes.\"",\n  \""decision\"": \""accept\"",\n  \""parameters\"": []\n}\n```"", ""accepted default basket 3""]",{},3,0,99,0,gpt-4o,
2025-02-10 17:10:07,test,6,4,"[""A"", ""B"", ""C"", ""D""]","{""A"": 6, ""B"": 1, ""C"": 6, ""D"": 17}","{""1"": {""A"": 1, ""B"": 5, ""C"": 1, ""D"": 5}, ""2"": {""A"": 2, ""B"": 3, ""C"": 5, ""D"": 4}, ""3"": {""A"": 4, ""B"": 1, ""C"": 3, ""D"": 5}, ""4"": {""A"": 3, ""B"": 5, ""C"": 3, ""D"": 4}, ""5"": {""A"": 3, ""B"": 3, ""C"": 4, ""D"": 4}, ""6"": {""A"": 3, ""B"": 1, ""C"": 1, ""D"": 2}}",True,4,3,"[""```json\n{\n  \""explanation\"": \""the recommended basket is basket 4, which is suggested based on the total count of prizes, assuming all prizes are equal. however, the prize values vary significantly, with d being worth 17 points, which is much higher than the others. to make an informed decision, i should reveal some boxes to understand the distribution of the high-value d prizes. this will help determine if basket 4 is indeed optimal or if another basket has more d prizes, which could be more valuable.\"",\n  \""decision\"": \""reveal\"",\n  \""parameters\"": [\""1 a\"", \""2 a\"", \""3 a\"", \""4 a\"", \""5 a\"", \""6 a\""]\n}\n```"", ""revealed 1 A"", ""revealed 2 A"", ""revealed 3 A"", ""revealed 4 A"", ""revealed 5 A"", ""revealed 6 A"", ""```json\n{\n  \""explanation\"": \""i have revealed the number of a prizes in each basket, but this information alone is not sufficient to determine the optimal basket because the high-value d prizes are still unknown. since d prizes are worth significantly more points, it is crucial to reveal some d prizes to assess their distribution across the baskets. this will help me decide whether to accept the recommended basket or choose another one with more d prizes.\"",\n  \""decision\"": \""reveal\"",\n  \""parameters\"": [\""1 d\"", \""2 d\"", \""3 d\"", \""4 d\"", \""5 d\"", \""6 d\""]\n}\n```"", ""revealed 1 D"", ""revealed 2 D"", ""revealed 3 D"", ""revealed 4 D"", ""revealed 5 D"", ""revealed 6 D"", ""```json\n{\n  \""explanation\"": \""after revealing the number of d prizes, i can see that basket 1 and basket 3 both have 5 d prizes, which is the highest among all baskets. since d prizes are worth 17 points each, these baskets are likely to have a higher payout. basket 3 also has 4 a prizes, which adds additional value. therefore, basket 3 seems to be the optimal choice based on the revealed information.\"",\n  \""decision\"": \""choose\"",\n  \""parameters\"": [3]\n}\n```"", ""chose basket 3""]","{""1,A"": 1, ""2,A"": 2, ""3,A"": 4, ""4,A"": 3, ""5,A"": 3, ""6,A"": 3, ""1,D"": 5, ""2,D"": 4, ""3,D"": 5, ""4,D"": 4, ""5,D"": 4, ""6,D"": 2}",3,24,104,0,gpt-4o,
